Date,Open,High,Low,Close,Volume,Market Cap,Time Open,Time High,Time Low,Time Close
13-10-2023,26752.8795584136,27092.696746124435,26686.32230944192,26862.375445622496,15165312851.42,524162174273.51,2023-10-13T00:00:00.000Z,2023-10-13T21:03:00.000Z,2023-10-13T17:35:00.000Z,2023-10-13T23:59:59.999Z
12-10-2023,26873.29249139075,26921.438902881455,26558.320783999003,26756.798638828568,9392909295.17,522077986120.86,2023-10-12T00:00:00.000Z,2023-10-12T02:55:00.000Z,2023-10-12T17:36:00.000Z,2023-10-12T23:59:59.999Z
11-10-2023,27392.07554608154,27474.116186528725,26561.099365503007,26873.321120758894,13648094333.06,524325019033.96,2023-10-11T00:00:00.000Z,2023-10-11T01:11:00.000Z,2023-10-11T17:50:00.000Z,2023-10-11T23:59:59.999Z
10-10-2023,27589.20110159883,27715.848347420426,27301.655078145017,27391.01951743658,9973350678.17,534398434701.94,2023-10-10T00:00:00.000Z,2023-10-10T08:34:00.000Z,2023-10-10T18:59:00.000Z,2023-10-10T23:59:59.999Z
09-10-2023,27934.47216233954,27989.470901969704,27302.561918923322,27583.678594954847,12007668568.18,538127916933.08,2023-10-09T00:00:00.000Z,2023-10-09T01:54:00.000Z,2023-10-09T16:46:00.000Z,2023-10-09T23:59:59.999Z
08-10-2023,27971.67810720863,28102.17039092581,27740.6630244878,27935.089580661173,7916875289.67,544957531993.92,2023-10-08T00:00:00.000Z,2023-10-08T03:45:00.000Z,2023-10-08T13:16:00.000Z,2023-10-08T23:59:59.999Z
07-10-2023,27946.781632976956,28028.09208690548,27870.423458053087,27968.838870789834,6553044316.48,545589873920.51,2023-10-07T00:00:00.000Z,2023-10-07T09:02:00.000Z,2023-10-07T00:27:00.000Z,2023-10-07T23:59:59.999Z
06-10-2023,27412.122423691733,28252.537569906584,27215.552446207737,27946.596779928914,13492391598.97,545126652148.46,2023-10-06T00:00:00.000Z,2023-10-06T21:39:00.000Z,2023-10-06T13:01:00.000Z,2023-10-06T23:59:59.999Z
05-10-2023,27798.647126999644,28091.861237067216,27375.6014238251,27415.91198216774,11877253669.95,534747363212.19,2023-10-05T00:00:00.000Z,2023-10-05T14:21:00.000Z,2023-10-05T17:21:00.000Z,2023-10-05T23:59:59.999Z
04-10-2023,27429.074995008952,27826.657948194268,27248.10624655641,27799.39409587958,11143355313.54,542203190963.03,2023-10-04T00:00:00.000Z,2023-10-04T19:12:00.000Z,2023-10-04T00:41:00.000Z,2023-10-04T23:59:59.999Z
03-10-2023,27508.251818807486,27667.192031153318,27216.001322534754,27429.979016663234,11407814186.59,534975274335.57,2023-10-03T00:00:00.000Z,2023-10-03T06:52:00.000Z,2023-10-03T20:07:00.000Z,2023-10-03T23:59:59.999Z
02-10-2023,27976.799152029067,28494.45963843138,27347.787579633296,27530.784889745028,19793041321.84,536912579985.45,2023-10-02T00:00:00.000Z,2023-10-02T14:00:00.000Z,2023-10-02T21:55:00.000Z,2023-10-02T23:59:59.999Z
01-10-2023,26967.39743314936,28047.237710026937,26965.094292320064,27983.75038178473,9503917434.43,545719315434.05,2023-10-01T00:00:00.000Z,2023-10-01T22:34:00.000Z,2023-10-01T00:34:00.000Z,2023-10-01T23:59:59.999Z
30-09-2023,26911.6891847171,27091.79550783723,26888.967803714917,26967.916301063717,5331172801.03,525885640459.76,2023-09-30T00:00:00.000Z,2023-09-30T15:47:00.000Z,2023-09-30T02:35:00.000Z,2023-09-30T23:59:59.999Z
29-09-2023,27024.84171393561,27225.93842991725,26721.762796688006,26911.72160276557,10396435377.43,524766460979.21,2023-09-29T00:00:00.000Z,2023-09-29T07:40:00.000Z,2023-09-29T14:10:00.000Z,2023-09-29T23:59:59.999Z
28-09-2023,26355.81239456195,27259.49922340818,26327.32171243625,27021.546764738454,14079002707.33,526883682824.27,2023-09-28T00:00:00.000Z,2023-09-28T16:27:00.000Z,2023-09-28T03:12:00.000Z,2023-09-28T23:59:59.999Z
27-09-2023,26209.49834944303,26817.842315275753,26111.464381993235,26352.717618908846,11718380997.24,513818515485.06,2023-09-27T00:00:00.000Z,2023-09-27T12:04:00.000Z,2023-09-27T18:08:00.000Z,2023-09-27T23:59:59.999Z
26-09-2023,26294.75867274134,26389.88478475173,26090.71240283964,26217.249335750654,9985498161.06,511151155986.8,2023-09-26T00:00:00.000Z,2023-09-26T03:43:00.000Z,2023-09-26T15:48:00.000Z,2023-09-26T23:59:59.999Z
25-09-2023,26253.775299437562,26421.508355599428,26011.46961577542,26298.47955117476,11997833256.53,512712185601.52,2023-09-25T00:00:00.000Z,2023-09-25T20:17:00.000Z,2023-09-25T12:23:00.000Z,2023-09-25T23:59:59.999Z
24-09-2023,26579.37398607126,26716.05846243727,26221.050004587993,26256.825786744543,8192867685.97,511876976253.54,2023-09-24T00:00:00.000Z,2023-09-24T18:06:00.000Z,2023-09-24T23:29:00.000Z,2023-09-24T23:59:59.999Z
23-09-2023,26578.555927115078,26634.18598484789,26520.519830485693,26579.389740560473,7404700300.94,518140112048.32,2023-09-23T00:00:00.000Z,2023-09-23T18:18:00.000Z,2023-09-23T04:06:00.000Z,2023-09-23T23:59:59.999Z
22-09-2023,26564.056167760817,26726.07803485976,26495.532412736065,26579.568637132503,10578746708.52,518118003343.51,2023-09-22T00:00:00.000Z,2023-09-22T08:13:00.000Z,2023-09-22T00:28:00.000Z,2023-09-22T23:59:59.999Z
21-09-2023,27129.840020945856,27152.93858022418,26389.300285872414,26567.632904403366,13371443707.65,517864270862.51,2023-09-21T00:00:00.000Z,2023-09-21T00:47:00.000Z,2023-09-21T14:01:00.000Z,2023-09-21T23:59:59.999Z
20-09-2023,27210.228491539736,27379.506073730878,26864.082320066333,27132.007340128497,13281116603.72,528841974545.7,2023-09-20T00:00:00.000Z,2023-09-20T02:04:00.000Z,2023-09-20T19:20:00.000Z,2023-09-20T23:59:59.999Z
19-09-2023,26760.851005767232,27488.763802195223,26681.605774694395,27211.117819724055,13807690550.44,530358455132.04,2023-09-19T00:00:00.000Z,2023-09-19T15:37:00.000Z,2023-09-19T00:31:00.000Z,2023-09-19T23:59:59.999Z
18-09-2023,26532.994793799102,27414.73425925601,26415.515845751543,26754.28103772525,15615339654.79,521431894478.28,2023-09-18T00:00:00.000Z,2023-09-18T13:04:00.000Z,2023-09-18T00:37:00.000Z,2023-09-18T23:59:59.999Z
17-09-2023,26567.927583002078,26617.997627579007,26445.075125456697,26534.187516849965,6774210669.73,517116820259.64,2023-09-17T00:00:00.000Z,2023-09-17T11:47:00.000Z,2023-09-17T01:12:00.000Z,2023-09-17T23:59:59.999Z
16-09-2023,26606.198652256913,26754.77018331882,26473.89077657253,26568.281287659884,7402031416.6,517755173478.6,2023-09-16T00:00:00.000Z,2023-09-16T02:22:00.000Z,2023-09-16T10:05:00.000Z,2023-09-16T23:59:59.999Z
15-09-2023,26533.818837729646,26840.49792522151,26240.700625430905,26608.693364912444,11479735788.3,518517274733.03,2023-09-15T00:00:00.000Z,2023-09-15T23:09:00.000Z,2023-09-15T15:00:00.000Z,2023-09-15T23:59:59.999Z
14-09-2023,26228.277860325095,26774.623356585485,26171.45185228815,26539.674442452662,13811359124.32,517140816824,2023-09-14T00:00:00.000Z,2023-09-14T18:37:00.000Z,2023-09-14T05:55:00.000Z,2023-09-14T23:59:59.999Z
13-09-2023,25837.554963292874,26376.11346939332,25781.12372763362,26228.32408751368,13072077070.22,511047406839.26,2023-09-13T00:00:00.000Z,2023-09-13T16:30:00.000Z,2023-09-13T00:07:00.000Z,2023-09-13T23:59:59.999Z
12-09-2023,25160.657925189484,26451.93849753749,25133.078908691517,25833.343060491483,18657279324.05,503327969520.61,2023-09-12T00:00:00.000Z,2023-09-12T16:31:00.000Z,2023-09-12T01:40:00.000Z,2023-09-12T23:59:59.999Z
11-09-2023,25831.71550073221,25883.947002717247,24930.297494168444,25162.655272247557,14600006466.65,490238023957.25,2023-09-11T00:00:00.000Z,2023-09-11T06:00:00.000Z,2023-09-11T20:02:00.000Z,2023-09-11T23:59:59.999Z
10-09-2023,25895.2099714338,25978.130167624386,25640.261707720892,25832.226246911396,7899553047.41,503258420290.44,2023-09-10T00:00:00.000Z,2023-09-10T22:34:00.000Z,2023-09-10T19:41:00.000Z,2023-09-10T23:59:59.999Z
09-09-2023,25905.424912482402,25921.97622636704,25810.495089688124,25895.678220958398,5481314132.31,504470470462.72,2023-09-09T00:00:00.000Z,2023-09-09T16:33:00.000Z,2023-09-09T13:43:00.000Z,2023-09-09T23:59:59.999Z
08-09-2023,26245.208208078435,26414.00597477302,25677.479580690466,25905.65375151327,10817356399.67,504640503023.3,2023-09-08T00:00:00.000Z,2023-09-08T00:58:00.000Z,2023-09-08T10:07:00.000Z,2023-09-08T23:59:59.999Z
07-09-2023,25748.312009430218,26409.303011092205,25608.20159567896,26240.19489212002,11088307100.27,511135039200.57,2023-09-07T00:00:00.000Z,2023-09-07T22:53:00.000Z,2023-09-07T14:01:00.000Z,2023-09-07T23:59:59.999Z
06-09-2023,25783.930744879006,25953.015656649026,25404.359679913214,25753.236258310782,12752705326.81,501626995525.47,2023-09-06T00:00:00.000Z,2023-09-06T17:56:00.000Z,2023-09-06T17:06:00.000Z,2023-09-06T23:59:59.999Z
05-09-2023,25814.95780798914,25858.374312520144,25589.98858554394,25779.98179498475,11094740039.8,502126527593.99,2023-09-05T00:00:00.000Z,2023-09-05T15:22:00.000Z,2023-09-05T03:24:00.000Z,2023-09-05T23:59:59.999Z
04-09-2023,25968.17013346548,26081.524605151673,25657.025567293684,25812.415268672812,10680635105.81,502737261224.55,2023-09-04T00:00:00.000Z,2023-09-04T03:21:00.000Z,2023-09-04T22:01:00.000Z,2023-09-04T23:59:59.999Z
03-09-2023,25869.47279272437,26087.149164750943,25817.031798422275,25969.56735263164,8962524522.99,505774022624.31,2023-09-03T00:00:00.000Z,2023-09-03T20:52:00.000Z,2023-09-03T16:41:00.000Z,2023-09-03T23:59:59.999Z
02-09-2023,25800.909609110324,25970.28448931195,25753.09384693841,25868.798140193212,10100387473.24,503786436420.87,2023-09-02T00:00:00.000Z,2023-09-02T15:41:00.000Z,2023-09-02T03:22:00.000Z,2023-09-02T23:59:59.999Z
01-09-2023,25934.02080615863,26125.869773720562,25362.609128156906,25800.72437260772,17202862221.48,502435875823.55,2023-09-01T00:00:00.000Z,2023-09-01T12:24:00.000Z,2023-09-01T17:42:00.000Z,2023-09-01T23:59:59.999Z
31-08-2023,27301.929316804566,27456.079001362155,25752.929946929373,25931.472893357368,20181001451.19,504957555550.64,2023-08-31T00:00:00.000Z,2023-08-31T11:43:00.000Z,2023-08-31T21:09:00.000Z,2023-08-31T23:59:59.999Z
30-08-2023,27726.08403402729,27760.159396603736,27069.207424583645,27297.265348320634,16343655235.34,531528938704.34,2023-08-30T00:00:00.000Z,2023-08-30T00:21:00.000Z,2023-08-30T15:04:00.000Z,2023-08-30T23:59:59.999Z
29-08-2023,26102.485832002574,28089.33802715427,25912.628908674877,27727.393009042426,29368391711.99,539882481562.26,2023-08-29T00:00:00.000Z,2023-08-29T16:28:00.000Z,2023-08-29T10:39:00.000Z,2023-08-29T23:59:59.999Z
28-08-2023,26089.614922885765,26198.579064448368,25880.600248890478,26106.1500439649,11002805166.45,508288516574.2,2023-08-28T00:00:00.000Z,2023-08-28T12:29:00.000Z,2023-08-28T07:46:00.000Z,2023-08-28T23:59:59.999Z
27-08-2023,26008.2418008294,26165.372438276096,25965.097538994913,26089.69347166345,6913768611.22,507949530130.7,2023-08-27T00:00:00.000Z,2023-08-27T17:02:00.000Z,2023-08-27T01:43:00.000Z,2023-08-27T23:59:59.999Z
26-08-2023,26047.235239637183,26107.384290580063,25983.878273926643,26008.46265966795,6034817316.31,506348824288.34,2023-08-26T00:00:00.000Z,2023-08-26T02:17:00.000Z,2023-08-26T12:46:00.000Z,2023-08-26T23:59:59.999Z
25-08-2023,26163.68005367363,26248.103427603295,25786.812461626567,26047.66885104809,12406045117.51,507090156466.72,2023-08-25T00:00:00.000Z,2023-08-25T14:17:00.000Z,2023-08-25T14:57:00.000Z,2023-08-25T23:59:59.999Z
24-08-2023,26431.51989246775,26554.90981737716,25914.925558946263,26162.37249495053,12871532023.01,509301597240.58,2023-08-24T00:00:00.000Z,2023-08-24T09:10:00.000Z,2023-08-24T17:39:00.000Z,2023-08-24T23:59:59.999Z
23-08-2023,26040.473651602013,26786.897605490947,25804.998186529647,26431.639982699646,16985265785.29,514519784075.08,2023-08-23T00:00:00.000Z,2023-08-23T19:49:00.000Z,2023-08-23T13:13:00.000Z,2023-08-23T23:59:59.999Z
22-08-2023,26130.748016041613,26135.50820329062,25520.728490708952,26031.656479448156,14503820706.42,506709265107.93,2023-08-22T00:00:00.000Z,2023-08-22T00:11:00.000Z,2023-08-22T21:27:00.000Z,2023-08-22T23:59:59.999Z
21-08-2023,26188.690650818713,26220.201684153268,25846.08797027676,26124.141253131012,13371557892.6,508487129875.96,2023-08-21T00:00:00.000Z,2023-08-21T21:36:00.000Z,2023-08-21T15:29:00.000Z,2023-08-21T23:59:59.999Z
20-08-2023,26096.861225500263,26260.680935384178,26004.31529959161,26189.584668660435,9036580419.74,509733936200.2,2023-08-20T00:00:00.000Z,2023-08-20T20:45:00.000Z,2023-08-20T15:10:00.000Z,2023-08-20T23:59:59.999Z
19-08-2023,26047.83297901064,26249.4483843828,25802.40788860038,26096.204550688082,10631443812.07,507889708783.63,2023-08-19T00:00:00.000Z,2023-08-19T17:00:00.000Z,2023-08-19T07:03:00.000Z,2023-08-19T23:59:59.999Z
18-08-2023,26636.07840210928,26808.195784726875,25668.922816845883,26049.55690088067,24026236529.35,506957746773.53,2023-08-18T00:00:00.000Z,2023-08-18T00:13:00.000Z,2023-08-18T17:08:00.000Z,2023-08-18T23:59:59.999Z
17-08-2023,28699.80283965744,28745.946525171366,25409.11160276864,26664.549993120152,31120851211.44,518904301900.92,2023-08-17T00:00:00.000Z,2023-08-17T00:15:00.000Z,2023-08-17T21:45:00.000Z,2023-08-17T23:59:59.999Z
16-08-2023,29169.074019916276,29221.97574297547,28701.77952453054,28701.77952453054,14949271904.13,558522450868.28,2023-08-16T00:00:00.000Z,2023-08-16T02:06:00.000Z,2023-08-16T23:59:00.000Z,2023-08-16T23:59:59.999Z
15-08-2023,29408.048589906968,29439.12042188584,29088.85327688286,29170.347205994203,12640195779.03,567610646871.25,2023-08-15T00:00:00.000Z,2023-08-15T15:04:00.000Z,2023-08-15T19:12:00.000Z,2023-08-15T23:59:59.999Z
14-08-2023,29283.262942771038,29660.25433927243,29124.105547239265,29408.442550403204,14013695304.04,572212182981.53,2023-08-14T00:00:00.000Z,2023-08-14T16:52:00.000Z,2023-08-14T02:22:00.000Z,2023-08-14T23:59:59.999Z
13-08-2023,29416.593599244316,29441.43338891422,29265.80759688342,29282.91437939815,7329897179.69,569738074810.23,2023-08-13T00:00:00.000Z,2023-08-13T03:00:00.000Z,2023-08-13T22:42:00.000Z,2023-08-13T23:59:59.999Z
12-08-2023,29399.786654848744,29465.11378374591,29357.587981112123,29415.96451621951,6194358007.75,572302297645.31,2023-08-12T00:00:00.000Z,2023-08-12T16:35:00.000Z,2023-08-12T03:45:00.000Z,2023-08-12T23:59:59.999Z
11-08-2023,29424.902574842985,29517.773668269485,29253.51798779874,29397.715497007066,10195168196.66,571917121193.64,2023-08-11T00:00:00.000Z,2023-08-11T14:48:00.000Z,2023-08-11T16:45:00.000Z,2023-08-11T23:59:59.999Z
10-08-2023,29563.971836560333,29688.564816471524,29354.446435792423,29429.592488566137,11865344788.64,572509489793.69,2023-08-10T00:00:00.000Z,2023-08-10T14:02:00.000Z,2023-08-10T17:33:00.000Z,2023-08-10T23:59:59.999Z
09-08-2023,29766.695595897992,30093.43518921235,29376.8005464538,29561.49450732431,18379521212.63,575052155346.9,2023-08-09T00:00:00.000Z,2023-08-09T13:01:00.000Z,2023-08-09T20:06:00.000Z,2023-08-09T23:59:59.999Z
08-08-2023,29180.01886208521,30176.79623748381,29113.814464067458,29765.492673562196,17570561357.26,578990356568.61,2023-08-08T00:00:00.000Z,2023-08-08T21:22:00.000Z,2023-08-08T02:03:00.000Z,2023-08-08T23:59:59.999Z
07-08-2023,29038.51284594314,29244.2808643985,28724.14053106778,29180.578921522465,13618163710.33,567589047795.07,2023-08-07T00:00:00.000Z,2023-08-07T21:31:00.000Z,2023-08-07T16:18:00.000Z,2023-08-07T23:59:59.999Z
06-08-2023,29043.701980163052,29160.82154415018,28963.834688306848,29041.85617094027,7269806993.78,564864625278.2,2023-08-06T00:00:00.000Z,2023-08-06T21:20:00.000Z,2023-08-06T16:10:00.000Z,2023-08-06T23:59:59.999Z
05-08-2023,29075.388956476294,29102.465652594947,28957.7976155422,29042.126150075645,6598366352.73,564840485745.58,2023-08-05T00:00:00.000Z,2023-08-05T00:48:00.000Z,2023-08-05T12:51:00.000Z,2023-08-05T23:59:59.999Z
04-08-2023,29174.38183697726,29302.0782223191,28885.33539940102,29074.091727772346,12036639987.62,565434912959.96,2023-08-04T00:00:00.000Z,2023-08-04T13:49:00.000Z,2023-08-04T20:51:00.000Z,2023-08-04T23:59:59.999Z
03-08-2023,29161.81194570409,29375.70702796135,28959.48820890262,29178.678779687,12780357745.55,567446140509.39,2023-08-03T00:00:00.000Z,2023-08-03T15:01:00.000Z,2023-08-03T08:27:00.000Z,2023-08-03T23:59:59.999Z
02-08-2023,29704.146838200217,29987.997112196714,28946.510378230032,29151.95968913307,19212655598.47,566898832325.3,2023-08-02T00:00:00.000Z,2023-08-02T01:33:00.000Z,2023-08-02T16:56:00.000Z,2023-08-02T23:59:59.999Z
01-08-2023,29230.872404990292,29675.732498060763,28657.02381974255,29675.732498060763,18272392391.28,577056102933.27,2023-08-01T00:00:00.000Z,2023-08-01T23:59:00.000Z,2023-08-01T15:31:00.000Z,2023-08-01T23:59:59.999Z
31-07-2023,29278.31405437211,29489.872868720275,29131.57903377326,29230.110878649015,11656781981.62,568365621732.67,2023-07-31T00:00:00.000Z,2023-07-31T00:50:00.000Z,2023-07-31T20:05:00.000Z,2023-07-31T23:59:59.999Z
30-07-2023,29357.093643392607,29443.169489786003,29059.502628570783,29275.307946896966,8678454526.64,569216997017.29,2023-07-30T00:00:00.000Z,2023-07-30T15:04:00.000Z,2023-07-30T20:03:00.000Z,2023-07-30T23:59:59.999Z
29-07-2023,29319.446037681606,29396.84375418112,29264.166273900406,29356.91853756984,6481775958.74,570774442718.62,2023-07-29T00:00:00.000Z,2023-07-29T04:27:00.000Z,2023-07-29T12:48:00.000Z,2023-07-29T23:59:59.999Z
28-07-2023,29212.164302427616,29521.5143305549,29125.845592149624,29319.24540303486,11218474951.63,570017791145.4,2023-07-28T00:00:00.000Z,2023-07-28T15:23:00.000Z,2023-07-28T08:11:00.000Z,2023-07-28T23:59:59.999Z
27-07-2023,29353.798829215375,29560.96626199313,29099.35225113293,29210.689277337366,10770779216.98,567881358904.56,2023-07-27T00:00:00.000Z,2023-07-27T09:56:00.000Z,2023-07-27T18:40:00.000Z,2023-07-27T23:59:59.999Z
26-07-2023,29225.76011533686,29675.552617399644,29113.91132357975,29354.972883148803,13497554655.35,570661758982.41,2023-07-26T00:00:00.000Z,2023-07-26T20:53:00.000Z,2023-07-26T01:38:00.000Z,2023-07-26T23:59:59.999Z
25-07-2023,29178.970044592083,29353.161104588005,29062.43429310641,29227.390799951987,10266772792.7,568155078548.47,2023-07-25T00:00:00.000Z,2023-07-25T18:41:00.000Z,2023-07-25T01:45:00.000Z,2023-07-25T23:59:59.999Z
24-07-2023,30081.66164457886,30093.3942473004,28934.294160245703,29176.915484832643,15395817395.41,567148527546.04,2023-07-24T00:00:00.000Z,2023-07-24T00:26:00.000Z,2023-07-24T15:11:00.000Z,2023-07-24T23:59:59.999Z
23-07-2023,29790.111646404206,30330.64039201111,29741.527314547297,30084.539240756265,9220145049.89,584762966697.84,2023-07-23T00:00:00.000Z,2023-07-23T19:08:00.000Z,2023-07-23T00:51:00.000Z,2023-07-23T23:59:59.999Z
22-07-2023,29908.69698861633,29991.61595644289,29664.12094534707,29771.80282777146,7873300597.52,578655924186.63,2023-07-22T00:00:00.000Z,2023-07-22T00:54:00.000Z,2023-07-22T23:32:00.000Z,2023-07-22T23:59:59.999Z
21-07-2023,29805.111530493545,30045.99751264125,29733.850999420774,29908.743898772045,10972789817.7,581292887481.78,2023-07-21T00:00:00.000Z,2023-07-21T18:39:00.000Z,2023-07-21T00:38:00.000Z,2023-07-21T23:59:59.999Z
20-07-2023,29915.250325865425,30195.531036727476,29638.096674876015,29792.016378050812,14655207120.53,579003905761.26,2023-07-20T00:00:00.000Z,2023-07-20T06:30:00.000Z,2023-07-20T18:31:00.000Z,2023-07-20T23:59:59.999Z
19-07-2023,29862.047207949952,30184.181151316767,29794.26886313251,29913.92319985428,12128602811.7,581348679162.13,2023-07-19T00:00:00.000Z,2023-07-19T04:37:00.000Z,2023-07-19T15:02:00.000Z,2023-07-19T23:59:59.999Z
18-07-2023,30147.070861420925,30233.65534901887,29556.428372971015,29856.563223120636,13138897269.16,580205937049.99,2023-07-18T00:00:00.000Z,2023-07-18T01:58:00.000Z,2023-07-18T16:49:00.000Z,2023-07-18T23:59:59.999Z
17-07-2023,30249.62661714303,30336.400133499996,29685.782686655515,30145.889625508702,13240156074.07,585797549895.29,2023-07-17T00:00:00.000Z,2023-07-17T05:14:00.000Z,2023-07-17T18:50:00.000Z,2023-07-17T23:59:59.999Z
16-07-2023,30297.472110816725,30437.560732332422,30089.67038375998,30249.132810296705,8516564469.72,587778068681.36,2023-07-16T00:00:00.000Z,2023-07-16T14:34:00.000Z,2023-07-16T02:22:00.000Z,2023-07-16T23:59:59.999Z
15-07-2023,30331.78227697352,30407.781109318264,30263.46341666242,30295.807483728026,8011667755.87,588656416080.43,2023-07-15T00:00:00.000Z,2023-07-15T01:43:00.000Z,2023-07-15T00:23:00.000Z,2023-07-15T23:59:59.999Z
14-07-2023,31474.721363624696,31582.254827237728,29966.38713650077,30334.069007690672,20917902659.76,589374459085.89,2023-07-14T00:00:00.000Z,2023-07-14T03:18:00.000Z,2023-07-14T19:06:00.000Z,2023-07-14T23:59:59.999Z
13-07-2023,30387.489196646333,31814.51481206781,30268.35248661994,31476.049385444207,23686079547.52,611535352757.7,2023-07-13T00:00:00.000Z,2023-07-13T19:32:00.000Z,2023-07-13T04:12:00.000Z,2023-07-13T23:59:59.999Z
12-07-2023,30622.24694556371,30959.9655594585,30228.83522031634,30391.646143934307,14805659716.84,590443005305.01,2023-07-12T00:00:00.000Z,2023-07-12T12:31:00.000Z,2023-07-12T19:37:00.000Z,2023-07-12T23:59:59.999Z
11-07-2023,30417.63362402037,30788.314619575805,30358.097742207156,30620.950938004094,12151839151.9,594872050276.47,2023-07-11T00:00:00.000Z,2023-07-11T15:19:00.000Z,2023-07-11T13:44:00.000Z,2023-07-11T23:59:59.999Z
10-07-2023,30172.422955372138,31026.083799965392,29985.394700634453,30414.471520592702,14828209155.42,590834747693.02,2023-07-10T00:00:00.000Z,2023-07-10T20:08:00.000Z,2023-07-10T00:18:00.000Z,2023-07-10T23:59:59.999Z
09-07-2023,30291.610530287548,30427.590660312413,30085.592193241242,30171.23357175826,7903327692.27,586079772336.97,2023-07-09T00:00:00.000Z,2023-07-09T14:37:00.000Z,2023-07-09T22:11:00.000Z,2023-07-09T23:59:59.999Z
08-07-2023,30346.92165283586,30374.436525061985,30080.159610240178,30292.541172641984,7509378699.36,588404379630.2,2023-07-08T00:00:00.000Z,2023-07-08T02:53:00.000Z,2023-07-08T19:25:00.000Z,2023-07-08T23:59:59.999Z
07-07-2023,29907.998902423325,30434.643694359656,29777.284410084438,30342.264752095933,13384770154.9,589336655273.9,2023-07-07T00:00:00.000Z,2023-07-07T16:13:00.000Z,2023-07-07T00:04:00.000Z,2023-07-07T23:59:59.999Z
06-07-2023,30507.15111094327,31460.053612687978,29892.226031563314,29909.337761100734,21129219508.8,580894851051.47,2023-07-06T00:00:00.000Z,2023-07-06T09:01:00.000Z,2023-07-06T14:41:00.000Z,2023-07-06T23:59:59.999Z
05-07-2023,30778.725362745445,30877.32925104366,30225.61269853897,30514.166392819956,12481622279.55,592615228830.8,2023-07-05T00:00:00.000Z,2023-07-05T03:54:00.000Z,2023-07-05T13:31:00.000Z,2023-07-05T23:59:59.999Z
04-07-2023,31156.864921655437,31325.198166376776,30659.355893337084,30777.581511167722,12810828427.35,597702171825.96,2023-07-04T00:00:00.000Z,2023-07-04T02:04:00.000Z,2023-07-04T19:33:00.000Z,2023-07-04T23:59:59.999Z
03-07-2023,30624.516311271615,31375.61325200148,30586.51343339069,31156.43949157535,15271884873.11,605031166919.12,2023-07-03T00:00:00.000Z,2023-07-03T19:52:00.000Z,2023-07-03T12:20:00.000Z,2023-07-03T23:59:59.999Z
02-07-2023,30587.269955877855,30766.139746690114,30264.018714366975,30620.77026344812,10533418042.02,594601955892.83,2023-07-02T00:00:00.000Z,2023-07-02T22:35:00.000Z,2023-07-02T15:25:00.000Z,2023-07-02T23:59:59.999Z
01-07-2023,30471.847563048803,30641.2893232817,30328.86474880932,30590.0790715004,9086606733,593974448099.12,2023-07-01T00:00:00.000Z,2023-07-01T15:03:00.000Z,2023-07-01T04:31:00.000Z,2023-07-01T23:59:59.999Z
30-06-2023,30441.35375917607,31256.862699554396,29600.275939419127,30477.251282244626,26387306196.78,591758288455.82,2023-06-30T00:00:00.000Z,2023-06-30T04:52:00.000Z,2023-06-30T13:48:00.000Z,2023-06-30T23:59:59.999Z
29-06-2023,30086.186717423134,30796.250239651657,30057.203020300094,30445.3512260882,13180860821.04,591107911061.22,2023-06-29T00:00:00.000Z,2023-06-29T13:19:00.000Z,2023-06-29T00:53:00.000Z,2023-06-29T23:59:59.999Z
28-06-2023,30696.56148684194,30703.27997632466,29921.82283255985,30086.24618852492,14571500779.44,584108674470.97,2023-06-28T00:00:00.000Z,2023-06-28T00:01:00.000Z,2023-06-28T19:32:00.000Z,2023-06-28T23:59:59.999Z
27-06-2023,30274.321187966107,31006.78657697437,30236.651293804374,30688.163854246024,16428827943.78,595773660616.42,2023-06-27T00:00:00.000Z,2023-06-27T14:09:00.000Z,2023-06-27T00:08:00.000Z,2023-06-27T23:59:59.999Z
26-06-2023,30480.523973068975,30636.029429573337,29955.743293732452,30271.131016739706,16493186997.21,587650439314.87,2023-06-26T00:00:00.000Z,2023-06-26T14:00:00.000Z,2023-06-26T17:17:00.000Z,2023-06-26T23:59:59.999Z
25-06-2023,30545.150233460405,31041.272067035912,30327.94278399382,30480.26160573749,12703464114.44,591683600297.12,2023-06-25T00:00:00.000Z,2023-06-25T04:39:00.000Z,2023-06-25T20:55:00.000Z,2023-06-25T23:59:59.999Z
24-06-2023,30708.738453966012,30804.14936626635,30290.14647599631,30548.694824738708,12147822495.52,592983006395.12,2023-06-24T00:00:00.000Z,2023-06-24T12:41:00.000Z,2023-06-24T16:04:00.000Z,2023-06-24T23:59:59.999Z
23-06-2023,29896.383424039625,31389.538128135737,29845.21450520376,30695.46940748955,24115570084.62,595803665519.79,2023-06-23T00:00:00.000Z,2023-06-23T16:15:00.000Z,2023-06-23T02:12:00.000Z,2023-06-23T23:59:59.999Z
22-06-2023,29995.935766599723,30495.998447137208,29679.157402267716,29912.28171476797,20653160490.91,580578124574.23,2023-06-22T00:00:00.000Z,2023-06-22T02:58:00.000Z,2023-06-22T14:54:00.000Z,2023-06-22T23:59:59.999Z
21-06-2023,28311.31096035663,30737.329223589204,28283.410778834826,30027.296453500956,33346760979.13,582785323709.11,2023-06-21T00:00:00.000Z,2023-06-21T16:36:00.000Z,2023-06-21T00:04:00.000Z,2023-06-21T23:59:59.999Z
20-06-2023,26841.663530099617,28388.968417499313,26668.7916991755,28327.488264328193,22211859146.73,549771733917.47,2023-06-20T00:00:00.000Z,2023-06-20T23:55:00.000Z,2023-06-20T14:30:00.000Z,2023-06-20T23:59:59.999Z
19-06-2023,26335.442369620123,26984.611526472378,26312.83180762957,26851.028545521316,12826986222.15,521094554604.37,2023-06-19T00:00:00.000Z,2023-06-19T18:16:00.000Z,2023-06-19T00:57:00.000Z,2023-06-19T23:59:59.999Z
18-06-2023,26510.457605282787,26675.925532231984,26325.890181020062,26336.213003281027,9565695128.64,511079706782.86,2023-06-18T00:00:00.000Z,2023-06-18T20:01:00.000Z,2023-06-18T23:54:00.000Z,2023-06-18T23:59:59.999Z
17-06-2023,26328.679439009575,26769.39450192045,26174.491649574386,26510.67644688794,11090276850.25,514442327519.51,2023-06-17T00:00:00.000Z,2023-06-17T05:42:00.000Z,2023-06-17T02:09:00.000Z,2023-06-17T23:59:59.999Z
16-06-2023,25575.28259536865,26463.173064552917,25245.357683111808,26327.46239421728,16324646965.41,510862345346.3,2023-06-16T00:00:00.000Z,2023-06-16T18:16:00.000Z,2023-06-16T14:47:00.000Z,2023-06-16T23:59:59.999Z
15-06-2023,25121.673946191986,25735.308541637325,24797.167848615383,25576.394008263604,15837384409.1,496264527631,2023-06-15T00:00:00.000Z,2023-06-15T21:34:00.000Z,2023-06-15T11:18:00.000Z,2023-06-15T23:59:59.999Z
14-06-2023,25920.258089139683,26041.800109474858,24902.152701215833,25124.676679840817,14265717765.8,487476514345.28,2023-06-14T00:00:00.000Z,2023-06-14T02:01:00.000Z,2023-06-14T20:50:00.000Z,2023-06-14T23:59:59.999Z
13-06-2023,25902.940909862198,26376.35206932344,25728.365567508503,25918.728401268156,14143474486.27,502863816038.37,2023-06-13T00:00:00.000Z,2023-06-13T12:32:00.000Z,2023-06-13T15:59:00.000Z,2023-06-13T23:59:59.999Z
12-06-2023,25934.285597359547,26087.919073186164,25675.19759436772,25902.499869783027,11677889997.4,502523702241.22,2023-06-12T00:00:00.000Z,2023-06-12T09:10:00.000Z,2023-06-12T02:50:00.000Z,2023-06-12T23:59:59.999Z
11-06-2023,25854.031918451117,26203.43980788956,25668.98560722756,25940.16808034339,10732609602.85,503230985845.05,2023-06-11T00:00:00.000Z,2023-06-11T20:12:00.000Z,2023-06-11T04:24:00.000Z,2023-06-11T23:59:59.999Z
10-06-2023,26481.762544708385,26531.04516335344,25501.83624158554,25851.241003169685,19872933188.93,501477392550.51,2023-06-10T00:00:00.000Z,2023-06-10T01:12:00.000Z,2023-06-10T17:04:00.000Z,2023-06-10T23:59:59.999Z
09-06-2023,26505.92400824293,26770.289117335557,26339.31522115061,26480.37509359513,11015551640.28,513657047934.28,2023-06-09T00:00:00.000Z,2023-06-09T13:25:00.000Z,2023-06-09T02:25:00.000Z,2023-06-09T23:59:59.999Z
08-06-2023,26347.65345388678,26797.51278671825,26246.663756236292,26508.215902156466,11904824295.26,514170400421.06,2023-06-08T00:00:00.000Z,2023-06-08T15:54:00.000Z,2023-06-08T03:33:00.000Z,2023-06-08T23:59:59.999Z
07-06-2023,27235.649518401624,27332.180956518452,26146.98886820858,26345.99885126687,19530045081.91,510996613395.63,2023-06-07T00:00:00.000Z,2023-06-07T00:47:00.000Z,2023-06-07T22:00:00.000Z,2023-06-07T23:59:59.999Z
06-06-2023,25732.108862845296,27313.820682417092,25434.86713154732,27238.783726217396,21929670692.82,528291607015.54,2023-06-06T00:00:00.000Z,2023-06-06T23:29:00.000Z,2023-06-06T12:15:00.000Z,2023-06-06T23:59:59.999Z
05-06-2023,27123.10996380917,27129.98258376833,25445.1675071202,25760.096999536112,21513292646.48,499587457194.46,2023-06-05T00:00:00.000Z,2023-06-05T00:11:00.000Z,2023-06-05T19:28:00.000Z,2023-06-05T23:59:59.999Z
04-06-2023,27075.122073387673,27407.018569538297,26968.224140905622,27119.067193126313,9360912318.14,525920232790.71,2023-06-04T00:00:00.000Z,2023-06-04T22:17:00.000Z,2023-06-04T01:08:00.000Z,2023-06-04T23:59:59.999Z
03-06-2023,27252.323332614993,27317.051854088637,26958.003739925192,27075.129398442477,8385597470.09,525043616807.54,2023-06-03T00:00:00.000Z,2023-06-03T16:30:00.000Z,2023-06-03T21:39:00.000Z,2023-06-03T23:59:59.999Z
02-06-2023,26824.556981119476,27303.861687267836,26574.644421230823,27249.588949088356,14837414999.85,528404436446.27,2023-06-02T00:00:00.000Z,2023-06-02T22:41:00.000Z,2023-06-02T00:39:00.000Z,2023-06-02T23:59:59.999Z
01-06-2023,27218.412375564356,27346.105483136533,26671.72115584082,26819.97321970769,14678970414.58,520044966564.46,2023-06-01T00:00:00.000Z,2023-06-01T00:17:00.000Z,2023-06-01T03:05:00.000Z,2023-06-01T23:59:59.999Z
31-05-2023,27700.530088711763,27831.67780370857,26866.45394440047,27219.658608110938,15656371534.37,527773175252.01,2023-05-31T00:00:00.000Z,2023-05-31T01:27:00.000Z,2023-05-31T16:09:00.000Z,2023-05-31T23:59:59.999Z
30-05-2023,27745.123603261192,28044.75979798264,27588.502765755577,27702.348774779613,13251081851.39,537106462875.19,2023-05-30T00:00:00.000Z,2023-05-30T10:38:00.000Z,2023-05-30T16:18:00.000Z,2023-05-30T23:59:59.999Z
29-05-2023,28075.592141166908,28432.038716970947,27563.877211181793,27745.884443552008,15181308983.6,537924888418.9,2023-05-29T00:00:00.000Z,2023-05-29T00:25:00.000Z,2023-05-29T17:07:00.000Z,2023-05-29T23:59:59.999Z
28-05-2023,26871.158775260013,28193.44853283095,26802.751730160704,28085.64736074923,14545229578.02,544483610242.01,2023-05-28T00:00:00.000Z,2023-05-28T23:16:00.000Z,2023-05-28T00:20:00.000Z,2023-05-28T23:59:59.999Z
27-05-2023,26720.18251355914,26888.88337077603,26621.14140510269,26868.35381843118,7892015141.24,520858138785.14,2023-05-27T00:00:00.000Z,2023-05-27T23:42:00.000Z,2023-05-27T13:58:00.000Z,2023-05-27T23:59:59.999Z
26-05-2023,26474.182469275427,26916.669912854042,26343.949157498468,26719.29098461734,12711619225.45,517943916949.93,2023-05-26T00:00:00.000Z,2023-05-26T14:35:00.000Z,2023-05-26T06:04:00.000Z,2023-05-26T23:59:59.999Z
25-05-2023,26329.461512587262,26591.519183094402,25890.594475345944,26476.207531973054,13851122696.86,513207340509.25,2023-05-25T00:00:00.000Z,2023-05-25T19:12:00.000Z,2023-05-25T01:28:00.000Z,2023-05-25T23:59:59.999Z
24-05-2023,27224.60370246231,27224.60370246231,26106.576623117977,26334.818214436535,16299104428.23,510440697384.33,2023-05-24T00:00:00.000Z,2023-05-24T00:00:00.000Z,2023-05-24T15:10:00.000Z,2023-05-24T23:59:59.999Z
23-05-2023,26855.960682040175,27434.684328204352,26816.179718120926,27225.726590634808,13697203142.64,527685629563.87,2023-05-23T00:00:00.000Z,2023-05-23T05:51:00.000Z,2023-05-23T01:10:00.000Z,2023-05-23T23:59:59.999Z
22-05-2023,26749.893205403107,27045.73508578749,26549.734792438765,26851.277627891304,11056770492.11,520401926578.4,2023-05-22T00:00:00.000Z,2023-05-22T13:51:00.000Z,2023-05-22T02:06:00.000Z,2023-05-22T23:59:59.999Z
21-05-2023,27118.423228280295,27265.917991795977,26706.921353513324,26753.82563905467,8647416920.95,518489461930.79,2023-05-21T00:00:00.000Z,2023-05-21T00:59:00.000Z,2023-05-21T21:25:00.000Z,2023-05-21T23:59:59.999Z
20-05-2023,26888.84139105379,27155.159026372767,26843.277380862277,27129.586255031238,7044911360.48,525746096848.12,2023-05-20T00:00:00.000Z,2023-05-20T18:16:00.000Z,2023-05-20T00:45:00.000Z,2023-05-20T23:59:59.999Z
19-05-2023,26826.754786389298,27128.618843259585,26700.21014229994,26890.12824240825,11258983300.89,521083278041.79,2023-05-19T00:00:00.000Z,2023-05-19T15:22:00.000Z,2023-05-19T15:35:00.000Z,2023-05-19T23:59:59.999Z
18-05-2023,27401.650207988976,27466.527590184734,26415.10148304567,26832.20930048602,15222938600.41,519935930271.57,2023-05-18T00:00:00.000Z,2023-05-18T12:17:00.000Z,2023-05-18T17:58:00.000Z,2023-05-18T23:59:59.999Z
17-05-2023,27035.470129713845,27465.927904294607,26600.14484430804,27398.802027965245,15140006925.18,530890147614.67,2023-05-17T00:00:00.000Z,2023-05-17T20:09:00.000Z,2023-05-17T14:03:00.000Z,2023-05-17T23:59:59.999Z
16-05-2023,27171.514579396786,27299.30481164118,26878.947971817197,27036.65070994403,12732238815.9,523846408825.17,2023-05-16T00:00:00.000Z,2023-05-16T00:30:00.000Z,2023-05-16T01:29:00.000Z,2023-05-16T23:59:59.999Z
15-05-2023,26931.384631905392,27646.34811866989,26766.09691604433,27192.693221164922,14413231792.03,526844318152.29,2023-05-15T00:00:00.000Z,2023-05-15T17:18:00.000Z,2023-05-15T00:53:00.000Z,2023-05-15T23:59:59.999Z
14-05-2023,26788.974291770766,27150.976791699217,26661.3549036476,26930.63784556426,10014858959.48,521742220416.76,2023-05-14T00:00:00.000Z,2023-05-14T15:10:00.000Z,2023-05-14T01:17:00.000Z,2023-05-14T23:59:59.999Z
13-05-2023,26807.769044398643,27030.482960302434,26710.873803047674,26784.078560882408,9999171605.08,518873704830.19,2023-05-13T00:00:00.000Z,2023-05-13T18:50:00.000Z,2023-05-13T00:32:00.000Z,2023-05-13T23:59:59.999Z
12-05-2023,26987.662513638646,27055.647228128175,25878.428829536035,26804.99067068782,19313599897.31,519254029391.83,2023-05-12T00:00:00.000Z,2023-05-12T00:57:00.000Z,2023-05-12T19:29:00.000Z,2023-05-12T23:59:59.999Z
11-05-2023,27621.08687181673,27621.941986176353,26781.82700214609,27000.788270733763,16724343943.18,523022981321.22,2023-05-11T00:00:00.000Z,2023-05-11T00:12:00.000Z,2023-05-11T17:49:00.000Z,2023-05-11T23:59:59.999Z
10-05-2023,27654.63677657879,28322.688327886328,26883.669882565664,27621.756227331287,20656025025.55,535026153601.52,2023-05-10T00:00:00.000Z,2023-05-10T13:06:00.000Z,2023-05-10T17:22:00.000Z,2023-05-10T23:59:59.999Z
09-05-2023,27695.068069254914,27821.400606356445,27375.600690258794,27658.77467251895,14128593255.78,535713623918.83,2023-05-09T00:00:00.000Z,2023-05-09T12:18:00.000Z,2023-05-09T16:06:00.000Z,2023-05-09T23:59:59.999Z
08-05-2023,28450.457477963737,28663.272331845226,27310.135612373655,27694.272896273116,19122903752.39,536375393861.25,2023-05-08T00:00:00.000Z,2023-05-08T00:28:00.000Z,2023-05-08T20:11:00.000Z,2023-05-08T23:59:59.999Z
07-05-2023,28901.62282413254,29157.51818533471,28441.368038323788,28454.978285513487,11301355486.45,551083296208.8,2023-05-07T00:00:00.000Z,2023-05-07T01:31:00.000Z,2023-05-07T23:56:00.000Z,2023-05-07T23:59:59.999Z
06-05-2023,29538.85900462101,29820.12662207653,28468.967409856246,28904.623949070778,15913866714.47,559767467680.94,2023-05-06T00:00:00.000Z,2023-05-06T00:38:00.000Z,2023-05-06T15:02:00.000Z,2023-05-06T23:59:59.999Z
05-05-2023,28851.479661785383,29668.90767712088,28845.51053371511,29534.384019704954,17936566518.34,571935354879.7,2023-05-05T00:00:00.000Z,2023-05-05T17:05:00.000Z,2023-05-05T00:18:00.000Z,2023-05-05T23:59:59.999Z
04-05-2023,29031.304447754515,29353.18465956154,28694.039024689486,28847.711590655163,15548678513.55,558617183940.51,2023-05-04T00:00:00.000Z,2023-05-04T10:38:00.000Z,2023-05-04T18:32:00.000Z,2023-05-04T23:59:59.999Z
03-05-2023,28680.494409624953,29259.533287999457,28178.3892452007,29006.30767090857,19122972518.31,561661086030.57,2023-05-03T00:00:00.000Z,2023-05-03T22:26:00.000Z,2023-05-03T15:03:00.000Z,2023-05-03T23:59:59.999Z
02-05-2023,28087.17496979201,28881.298380463573,27924.12367498072,28680.53696791293,16432924526.63,555325979264.04,2023-05-02T00:00:00.000Z,2023-05-02T19:12:00.000Z,2023-05-02T05:07:00.000Z,2023-05-02T23:59:59.999Z
01-05-2023,29227.10398190992,29329.93622110556,27680.792639691088,28091.56880389237,18655599976.36,543900696259.74,2023-05-01T00:00:00.000Z,2023-05-01T00:50:00.000Z,2023-05-01T20:59:00.000Z,2023-05-01T23:59:59.999Z
30-04-2023,29245.515512462294,29952.02855265972,29114.021236277837,29268.807043162557,14652199272.27,566661285145.37,2023-04-30T00:00:00.000Z,2023-04-30T15:42:00.000Z,2023-04-30T02:00:00.000Z,2023-04-30T23:59:59.999Z
29-04-2023,29336.567035251155,29452.455244901885,29088.042336489525,29248.488372917574,10662634332.91,566240497928.76,2023-04-29T00:00:00.000Z,2023-04-29T04:26:00.000Z,2023-04-29T17:32:00.000Z,2023-04-29T23:59:59.999Z
28-04-2023,29481.013535027447,29572.791692792915,28929.60854188226,29340.262498158005,17544464887.25,567993007155.91,2023-04-28T00:00:00.000Z,2023-04-28T01:02:00.000Z,2023-04-28T13:54:00.000Z,2023-04-28T23:59:59.999Z
27-04-2023,28428.464278678897,29871.54635164288,28402.88738665169,29473.786183672837,27153445027.31,570550222405.71,2023-04-27T00:00:00.000Z,2023-04-27T18:46:00.000Z,2023-04-27T00:02:00.000Z,2023-04-27T23:59:59.999Z
26-04-2023,28300.05927438531,29995.83849111743,27324.549006523932,28422.70087849232,31854242019.49,550180352607.55,2023-04-26T00:00:00.000Z,2023-04-26T12:59:00.000Z,2023-04-26T20:03:00.000Z,2023-04-26T23:59:59.999Z
25-04-2023,27514.87239121884,28371.077696197786,27207.932556740943,28307.59809066535,17733373139.17,547928945542.45,2023-04-25T00:00:00.000Z,2023-04-25T22:05:00.000Z,2023-04-25T08:24:00.000Z,2023-04-25T23:59:59.999Z
24-04-2023,27591.729521890473,27979.98190066292,27070.849499552543,27525.33949959111,17703288330.24,532766516006.96,2023-04-24T00:00:00.000Z,2023-04-24T01:20:00.000Z,2023-04-24T16:56:00.000Z,2023-04-24T23:59:59.999Z
23-04-2023,27816.144792576142,27820.24449092755,27400.313735867676,27591.38463190681,12785446832.04,534020212996.71,2023-04-23T00:00:00.000Z,2023-04-23T00:01:00.000Z,2023-04-23T18:51:00.000Z,2023-04-23T23:59:59.999Z
22-04-2023,27265.89501625829,27872.143167903887,27169.57112040993,27817.500917437257,13125734602.38,538371205878.3,2023-04-22T00:00:00.000Z,2023-04-22T23:08:00.000Z,2023-04-22T01:18:00.000Z,2023-04-22T23:59:59.999Z
21-04-2023,28249.231270723743,28349.967857708452,27177.365299574205,27276.909687575568,20759504329.87,527883377617.69,2023-04-21T00:00:00.000Z,2023-04-21T00:49:00.000Z,2023-04-21T22:39:00.000Z,2023-04-21T23:59:59.999Z
20-04-2023,28823.682862437203,29076.401048519936,28037.25725722351,28245.98731049337,21340360359.79,546611911812.66,2023-04-20T00:00:00.000Z,2023-04-20T06:19:00.000Z,2023-04-20T19:29:00.000Z,2023-04-20T23:59:59.999Z
19-04-2023,30394.187904359267,30411.053790876467,28669.898268151563,28822.680472900887,24571565420.76,557748035703.28,2023-04-19T00:00:00.000Z,2023-04-19T00:19:00.000Z,2023-04-19T23:24:00.000Z,2023-04-19T23:59:59.999Z
18-04-2023,29449.0917046267,30470.302014738132,29154.84937086217,30397.55273552258,19480529496.02,588197752221.23,2023-04-18T00:00:00.000Z,2023-04-18T12:23:00.000Z,2023-04-18T01:16:00.000Z,2023-04-18T23:59:59.999Z
17-04-2023,30317.145697415202,30319.196576603867,29275.371057633616,29445.044904962764,17872186762.03,569735854496.74,2023-04-17T00:00:00.000Z,2023-04-17T00:02:00.000Z,2023-04-17T15:41:00.000Z,2023-04-17T23:59:59.999Z
16-04-2023,30315.976416622234,30555.53763344086,30157.832325260348,30315.35545612029,12854816416.5,586546802552.23,2023-04-16T00:00:00.000Z,2023-04-16T19:33:00.000Z,2023-04-16T01:13:00.000Z,2023-04-16T23:59:59.999Z
15-04-2023,30490.74927242369,30601.740164292667,30245.881938715993,30318.496953064554,11940685377.62,586582359795.4,2023-04-15T00:00:00.000Z,2023-04-15T00:28:00.000Z,2023-04-15T17:37:00.000Z,2023-04-15T23:59:59.999Z
14-04-2023,30409.5616914944,31005.608044472887,30044.497509619017,30485.700029255324,22659995079.31,589786626446.89,2023-04-14T00:00:00.000Z,2023-04-14T06:54:00.000Z,2023-04-14T16:50:00.000Z,2023-04-14T23:59:59.999Z
13-04-2023,29892.73945987711,30539.846481282515,29878.622163408105,30399.066385491835,17487721001.39,588084165990.41,2023-04-13T00:00:00.000Z,2023-04-13T18:16:00.000Z,2023-04-13T00:20:00.000Z,2023-04-13T23:59:59.999Z
12-04-2023,30231.581623239563,30462.480941487043,29725.573350158436,30139.052871052005,18651929926.37,583034311648.57,2023-04-12T00:00:00.000Z,2023-04-12T12:36:00.000Z,2023-04-12T15:14:00.000Z,2023-04-12T23:59:59.999Z
11-04-2023,29653.679647445995,30509.083666456423,29609.301368034943,30235.058938955266,20121259843.07,584854674446.17,2023-04-11T00:00:00.000Z,2023-04-11T19:19:00.000Z,2023-04-11T00:10:00.000Z,2023-04-11T23:59:59.999Z
10-04-2023,28336.028237401144,29771.463928909954,28189.270771369433,29652.98009708406,19282400094.3,573568312635.13,2023-04-10T00:00:00.000Z,2023-04-10T23:15:00.000Z,2023-04-10T13:58:00.000Z,2023-04-10T23:59:59.999Z
09-04-2023,27952.367615612475,28532.829969278082,27828.481410543493,28333.050047624925,12175322950.95,548015190714.46,2023-04-09T00:00:00.000Z,2023-04-09T22:07:00.000Z,2023-04-09T14:22:00.000Z,2023-04-09T23:59:59.999Z
08-04-2023,27920.512778528697,28159.862779875504,27883.386552621025,27947.79454969423,9373255556,540536533674.58,2023-04-08T00:00:00.000Z,2023-04-08T05:57:00.000Z,2023-04-08T00:55:00.000Z,2023-04-08T23:59:59.999Z
07-04-2023,28038.9669696205,28111.59328412164,27794.03182581009,27925.859408412933,10861680497.27,540086456069.02,2023-04-07T00:00:00.000Z,2023-04-07T00:57:00.000Z,2023-04-07T07:57:00.000Z,2023-04-07T23:59:59.999Z
06-04-2023,28175.22707737488,28178.384312375736,27738.759361405984,28044.139754944128,13837809380.28,542349825341.83,2023-04-06T00:00:00.000Z,2023-04-06T00:01:00.000Z,2023-04-06T10:38:00.000Z,2023-04-06T23:59:59.999Z
05-04-2023,28169.726952853987,28739.238110653572,27843.76449542776,28177.9835569508,17052315986.14,544910072721.85,2023-04-05T00:00:00.000Z,2023-04-05T02:38:00.000Z,2023-04-05T16:17:00.000Z,2023-04-05T23:59:59.999Z
04-04-2023,27795.274323998936,28433.742975997215,27681.305056614092,28168.0898164027,15284538858.55,544693901827.85,2023-04-04T00:00:00.000Z,2023-04-04T11:09:00.000Z,2023-04-04T00:38:00.000Z,2023-04-04T23:59:59.999Z
03-04-2023,28183.0803582438,28475.622507498865,27276.719948809692,27790.220854773645,19556501326.93,537360742269.69,2023-04-03T00:00:00.000Z,2023-04-03T10:31:00.000Z,2023-04-03T21:02:00.000Z,2023-04-03T23:59:59.999Z
02-04-2023,28462.844801116054,28518.958407845254,27884.087091328583,28199.308383774474,12284641999.34,545245950698.05,2023-04-02T00:00:00.000Z,2023-04-02T03:40:00.000Z,2023-04-02T22:20:00.000Z,2023-04-02T23:59:59.999Z
01-04-2023,28473.331801197142,28802.45747844686,28297.172497645388,28411.03424309244,10876469900.68,549318113504.07,2023-04-01T00:00:00.000Z,2023-04-01T02:02:00.000Z,2023-04-01T15:04:00.000Z,2023-04-01T23:59:59.999Z
31-03-2023,28032.2622677886,28639.896083757507,27583.715260068304,28478.484605680438,19001327597.88,550593053896.62,2023-03-31T00:00:00.000Z,2023-03-31T14:52:00.000Z,2023-03-31T07:48:00.000Z,2023-03-31T23:59:59.999Z
30-03-2023,28350.141491187987,29159.90261786623,27720.15933761617,28033.563150395665,22435349950.56,541964802720.42,2023-03-30T00:00:00.000Z,2023-03-30T02:41:00.000Z,2023-03-30T18:11:00.000Z,2023-03-30T23:59:59.999Z
29-03-2023,27267.03217460021,28619.543388800823,27259.66118041008,28348.442342812003,20684945905.97,548025510532.62,2023-03-29T00:00:00.000Z,2023-03-29T08:38:00.000Z,2023-03-29T00:49:00.000Z,2023-03-29T23:59:59.999Z
28-03-2023,27132.888921445134,27460.7194594252,26677.81872811284,27268.131482914527,17783600384.84,527117850100.66,2023-03-28T00:00:00.000Z,2023-03-28T20:01:00.000Z,2023-03-28T10:55:00.000Z,2023-03-28T23:59:59.999Z
27-03-2023,27994.067923252504,28037.925860641368,26606.689001139537,27139.88853052214,18188895177.73,524615890807.42,2023-03-27T00:00:00.000Z,2023-03-27T00:53:00.000Z,2023-03-27T15:12:00.000Z,2023-03-27T23:59:59.999Z
26-03-2023,27495.52395825096,28178.144437213232,27445.046354925245,27994.32951422271,13878363191.96,541106062437.58,2023-03-26T00:00:00.000Z,2023-03-26T13:59:00.000Z,2023-03-26T00:18:00.000Z,2023-03-26T23:59:59.999Z
25-03-2023,27487.337738386257,27791.825602760004,27196.233829504792,27494.706878377543,13383005987.37,531424045822.58,2023-03-25T00:00:00.000Z,2023-03-25T15:52:00.000Z,2023-03-25T20:03:00.000Z,2023-03-25T23:59:59.999Z
24-03-2023,28324.11169520493,28388.437745563944,27039.265431502597,27493.285143623496,25980310960.02,531370969956.36,2023-03-24T00:00:00.000Z,2023-03-24T00:25:00.000Z,2023-03-24T21:36:00.000Z,2023-03-24T23:59:59.999Z
23-03-2023,27301.957494354938,28729.843469678315,27183.363740707282,28333.972711378767,24220433689.12,547590658474.12,2023-03-23T00:00:00.000Z,2023-03-23T15:18:00.000Z,2023-03-23T01:53:00.000Z,2023-03-23T23:59:59.999Z
22-03-2023,28158.719991806116,28803.33592066941,26759.99623312224,27307.436768413274,33382021889.86,527720639354.35,2023-03-22T00:00:00.000Z,2023-03-22T18:06:00.000Z,2023-03-22T20:00:00.000Z,2023-03-22T23:59:59.999Z
21-03-2023,27768.39203181537,28439.561588710232,27439.647094150285,28175.816835424946,36102192830.48,544473344614.66,2023-03-21T00:00:00.000Z,2023-03-21T16:54:00.000Z,2023-03-21T07:14:00.000Z,2023-03-21T23:59:59.999Z
20-03-2023,28041.601917494194,28527.72422274135,27242.880702919123,27767.236331826196,44774027663.55,536553055078.31,2023-03-20T00:00:00.000Z,2023-03-20T09:05:00.000Z,2023-03-20T03:54:00.000Z,2023-03-20T23:59:59.999Z
19-03-2023,26969.503787812773,28440.561217258273,26907.71627371266,28038.674946765103,37769448858.69,541771324421.11,2023-03-19T00:00:00.000Z,2023-03-19T20:12:00.000Z,2023-03-19T07:12:00.000Z,2023-03-19T23:59:59.999Z
18-03-2023,27448.117269610462,27725.953416209864,26636.260945975282,26965.879757026636,35723036817.12,521018360376.26,2023-03-18T00:00:00.000Z,2023-03-18T01:06:00.000Z,2023-03-18T16:32:00.000Z,2023-03-18T23:59:59.999Z
17-03-2023,25055.123219270015,27787.812225225498,24955.169055285627,27423.930634049197,50730261335.05,529839581714.46,2023-03-17T00:00:00.000Z,2023-03-17T22:49:00.000Z,2023-03-17T00:40:00.000Z,2023-03-17T23:59:59.999Z
16-03-2023,24373.456617017335,25190.32698449262,24225.110958628262,25052.78972174803,33866061746.62,484005642386.83,2023-03-16T00:00:00.000Z,2023-03-16T19:26:00.000Z,2023-03-16T01:20:00.000Z,2023-03-16T23:59:59.999Z
15-03-2023,24770.925668702967,25240.615818348535,23964.909846876988,24375.961357831246,43655701450.2,470908667056.64,2023-03-15T00:00:00.000Z,2023-03-15T13:23:00.000Z,2023-03-15T17:05:00.000Z,2023-03-15T23:59:59.999Z
14-03-2023,24201.76600614591,26514.717165528455,24081.18265166227,24746.074658847734,54622230163.97,478037073214.71,2023-03-14T00:00:00.000Z,2023-03-14T13:05:00.000Z,2023-03-14T00:15:00.000Z,2023-03-14T23:59:59.999Z
13-03-2023,22156.406675322058,24550.837485761334,21918.199930890016,24197.5329977753,49466362688.47,467417380966.85,2023-03-13T00:00:00.000Z,2023-03-13T15:32:00.000Z,2023-03-13T10:19:00.000Z,2023-03-13T23:59:59.999Z
12-03-2023,20628.029034458348,22185.03111087706,20448.80626107676,22163.94995191503,29279035521.01,428114557464.91,2023-03-12T00:00:00.000Z,2023-03-12T23:58:00.000Z,2023-03-12T07:49:00.000Z,2023-03-12T23:59:59.999Z
11-03-2023,20187.877074733235,20792.525692444524,20068.66031241524,20632.409629392565,30180288175.61,398509689462.45,2023-03-11T00:00:00.000Z,2023-03-11T05:59:00.000Z,2023-03-11T12:56:00.000Z,2023-03-11T23:59:59.999Z
10-03-2023,20367.00177713576,20370.595398116,19628.254309420507,20187.243647616287,39578257695.31,389890609883.9,2023-03-10T00:00:00.000Z,2023-03-10T00:03:00.000Z,2023-03-10T11:25:00.000Z,2023-03-10T23:59:59.999Z
09-03-2023,21720.07931756107,21802.71668117176,20210.3067467507,20363.021111725368,30364664170.83,393268847887.5,2023-03-09T00:00:00.000Z,2023-03-09T03:42:00.000Z,2023-03-09T21:01:00.000Z,2023-03-09T23:59:59.999Z
08-03-2023,22216.442321102208,22268.896252187904,21708.050506040505,21718.079830432067,22536575684.49,419421447158.25,2023-03-08T00:00:00.000Z,2023-03-08T00:23:00.000Z,2023-03-08T23:43:00.000Z,2023-03-08T23:59:59.999Z
07-03-2023,22428.32238968881,22527.41864168071,22011.262496656873,22219.76907094175,22765452203.97,429090671120,2023-03-07T00:00:00.000Z,2023-03-07T03:07:00.000Z,2023-03-07T21:25:00.000Z,2023-03-07T23:59:59.999Z
06-03-2023,22436.81677589737,22584.293808702274,22331.314828369683,22429.75753334634,17353192895.19,433122543176.49,2023-03-06T00:00:00.000Z,2023-03-06T16:05:00.000Z,2023-03-06T05:07:00.000Z,2023-03-06T23:59:59.999Z
05-03-2023,22354.14359815582,22613.685230682047,22307.143313422126,22435.514196973487,13317001732.58,433216160786.45,2023-03-05T00:00:00.000Z,2023-03-05T01:49:00.000Z,2023-03-05T02:41:00.000Z,2023-03-05T23:59:59.999Z
04-03-2023,22362.92302679091,22405.1769535758,22198.981009392606,22353.350073930676,11166012913.03,431607268094.04,2023-03-04T00:00:00.000Z,2023-03-04T06:35:00.000Z,2023-03-04T20:49:00.000Z,2023-03-04T23:59:59.999Z
03-03-2023,23476.633731258356,23479.34809376563,22213.23759376628,22362.6793319333,26062404610.39,431765463285.53,2023-03-03T00:00:00.000Z,2023-03-03T00:04:00.000Z,2023-03-03T21:22:00.000Z,2023-03-03T23:59:59.999Z
02-03-2023,23647.019473129796,23739.138076779185,23245.021433240236,23475.466737662264,20386398516.25,453226586695.74,2023-03-02T00:00:00.000Z,2023-03-02T00:24:00.000Z,2023-03-02T14:23:00.000Z,2023-03-02T23:59:59.999Z
01-03-2023,23150.92995817847,23880.63246286755,23088.626699901255,23646.549899144964,24662841199.56,456508161672.8,2023-03-01T00:00:00.000Z,2023-03-01T09:01:00.000Z,2023-03-01T00:57:00.000Z,2023-03-01T23:59:59.999Z
28-02-2023,23521.838822394886,23585.38406953924,23077.6503704068,23147.35338990846,20535363433.98,446846764116.35,2023-02-28T00:00:00.000Z,2023-02-28T16:10:00.000Z,2023-02-28T21:44:00.000Z,2023-02-28T23:59:59.999Z
27-02-2023,23561.450681524497,23857.891125262795,23205.879245350094,23522.871914506002,22660763494.22,454075216419.73,2023-02-27T00:00:00.000Z,2023-02-27T15:11:00.000Z,2023-02-27T18:35:00.000Z,2023-02-27T23:59:59.999Z
26-02-2023,23174.15076871508,23654.367374645797,23084.221639724135,23561.212910916336,16644534841.91,454795165822.83,2023-02-26T00:00:00.000Z,2023-02-26T20:46:00.000Z,2023-02-26T02:20:00.000Z,2023-02-26T23:59:59.999Z
25-02-2023,23200.125853429145,23210.211072334423,22861.558664814136,23175.375635842458,16100721565.07,447323985682.72,2023-02-25T00:00:00.000Z,2023-02-25T00:31:00.000Z,2023-02-25T20:50:00.000Z,2023-02-25T23:59:59.999Z
24-02-2023,23946.007863671563,24103.704483456677,23007.07132664495,23198.12748788315,26811744927.57,447747058643.64,2023-02-24T00:00:00.000Z,2023-02-24T01:19:00.000Z,2023-02-24T19:46:00.000Z,2023-02-24T23:59:59.999Z
23-02-2023,24190.71898354621,24572.089421454446,23693.919485258688,23947.49252317601,30476264066,462189287816.46,2023-02-23T00:00:00.000Z,2023-02-23T03:05:00.000Z,2023-02-23T12:08:00.000Z,2023-02-23T23:59:59.999Z
22-02-2023,24437.418479922784,24472.33975721861,23644.317715789413,24188.842976694308,30199996780.9,466821375594.42,2023-02-22T00:00:00.000Z,2023-02-22T00:10:00.000Z,2023-02-22T17:16:00.000Z,2023-02-22T23:59:59.999Z
21-02-2023,24833.048914297397,25126.851685722035,24200.364116338482,24436.354484576015,31252098713.68,471577656114.25,2023-02-21T00:00:00.000Z,2023-02-21T08:30:00.000Z,2023-02-21T22:06:00.000Z,2023-02-21T23:59:59.999Z
20-02-2023,24336.623340482118,25020.45951252541,23927.909253473492,24829.14756994915,28987376572.9,479132405758.14,2023-02-20T00:00:00.000Z,2023-02-20T15:10:00.000Z,2023-02-20T01:16:00.000Z,2023-02-20T23:59:59.999Z
19-02-2023,24640.02722142087,25093.05514954421,24327.641672282658,24327.641672282658,25555105669.92,469431477134.26,2023-02-19T00:00:00.000Z,2023-02-19T16:16:00.000Z,2023-02-19T23:59:00.000Z,2023-02-19T23:59:59.999Z
18-02-2023,24565.295999850914,24798.835570650936,24468.373630858852,24641.276948425817,19625427157.74,475459130854.86,2023-02-18T00:00:00.000Z,2023-02-18T18:16:00.000Z,2023-02-18T11:01:00.000Z,2023-02-18T23:59:59.999Z
17-02-2023,23621.282494263785,24924.04006030843,23460.756026631254,24565.601988946673,41358451254.72,473972409615.04,2023-02-17T00:00:00.000Z,2023-02-17T20:26:00.000Z,2023-02-17T00:04:00.000Z,2023-02-17T23:59:59.999Z
16-02-2023,24307.350197799304,25134.11735019613,23602.522501390988,23623.474480806268,39316664596.38,455770787833.36,2023-02-16T00:00:00.000Z,2023-02-16T16:06:00.000Z,2023-02-16T23:55:00.000Z,2023-02-16T23:59:59.999Z
15-02-2023,22220.585338474528,24307.841328484352,22082.76908076793,24307.841328484352,32483312909.3,468947166603.22,2023-02-15T00:00:00.000Z,2023-02-15T23:59:00.000Z,2023-02-15T02:52:00.000Z,2023-02-15T23:59:59.999Z
14-02-2023,21801.823146444163,22293.140093450103,21632.393983859154,22220.80414369751,26792596580.6,428662088256.18,2023-02-14T00:00:00.000Z,2023-02-14T15:16:00.000Z,2023-02-14T14:33:00.000Z,2023-02-14T23:59:59.999Z
13-02-2023,21786.9992632743,21898.413839675686,21460.088503864434,21808.10177360093,23918742607.37,420678828415.31,2023-02-13T00:00:00.000Z,2023-02-13T07:25:00.000Z,2023-02-13T17:57:00.000Z,2023-02-13T23:59:59.999Z
12-02-2023,21870.902501849163,22060.99460655736,21682.828774706803,21788.203986260593,17821046405.57,420274300806.28,2023-02-12T00:00:00.000Z,2023-02-12T16:41:00.000Z,2023-02-12T22:10:00.000Z,2023-02-12T23:59:59.999Z
11-02-2023,21651.841862003555,21891.410562977795,21618.449727617524,21870.874064054547,16356226232,421847190488.29,2023-02-11T00:00:00.000Z,2023-02-11T23:35:00.000Z,2023-02-11T00:16:00.000Z,2023-02-11T23:59:59.999Z
10-02-2023,21819.006420404912,21941.185603316964,21539.39283051438,21651.183782936125,27078406593.87,417588395181.59,2023-02-10T00:00:00.000Z,2023-02-10T03:00:00.000Z,2023-02-10T21:46:00.000Z,2023-02-10T23:59:59.999Z
09-02-2023,22946.56551860676,22996.43751078374,21773.974614057337,21819.039914736517,32572572185.34,420806214870.32,2023-02-09T00:00:00.000Z,2023-02-09T01:03:00.000Z,2023-02-09T22:58:00.000Z,2023-02-09T23:59:59.999Z
08-02-2023,23263.415126044525,23367.95928740589,22731.09821330102,22939.398700684054,25371367757.61,442391167095.22,2023-02-08T00:00:00.000Z,2023-02-08T01:17:00.000Z,2023-02-08T16:28:00.000Z,2023-02-08T23:59:59.999Z
07-02-2023,22757.26754187948,23310.975071816956,22756.258276985336,23264.291187691553,27187964470.79,448636152158.08,2023-02-07T00:00:00.000Z,2023-02-07T18:02:00.000Z,2023-02-07T00:02:00.000Z,2023-02-07T23:59:59.999Z
06-02-2023,22954.021964172887,23119.27995032012,22692.02598404982,22760.109263300423,23825006541.98,438893838655.36,2023-02-06T00:00:00.000Z,2023-02-06T16:23:00.000Z,2023-02-06T23:22:00.000Z,2023-02-06T23:59:59.999Z
05-02-2023,23332.247600951167,23423.435611538534,22841.760312501065,22955.666016297437,19564262605.21,442642331535.6,2023-02-05T00:00:00.000Z,2023-02-05T08:43:00.000Z,2023-02-05T19:29:00.000Z,2023-02-05T23:59:59.999Z
04-02-2023,23446.320726972564,23556.94880508433,23291.795658887062,23331.84713709607,15639298538.02,449874457148.45,2023-02-04T00:00:00.000Z,2023-02-04T13:21:00.000Z,2023-02-04T05:29:00.000Z,2023-02-04T23:59:59.999Z
03-02-2023,23469.412507140038,23678.10257647552,23279.9557414819,23449.32162150656,27083066007.24,452119476083.72,2023-02-03T00:00:00.000Z,2023-02-03T16:37:00.000Z,2023-02-03T20:07:00.000Z,2023-02-03T23:59:59.999Z
02-02-2023,23720.82351727543,24167.210232201985,23468.595282557166,23471.870441279425,32066936882,452534728124.07,2023-02-02T00:00:00.000Z,2023-02-02T01:01:00.000Z,2023-02-02T23:58:00.000Z,2023-02-02T23:59:59.999Z
01-02-2023,23137.835136150523,23764.53929417068,22877.75065255435,23723.769653484665,26683255504.12,457370104397.91,2023-02-01T00:00:00.000Z,2023-02-01T22:25:00.000Z,2023-02-01T19:35:00.000Z,2023-02-01T23:59:59.999Z
31-01-2023,22840.796090600143,23225.02140388607,22765.56849944083,23139.283909912327,22837828665.18,446082285297.19,2023-01-31T00:00:00.000Z,2023-01-31T22:55:00.000Z,2023-01-31T00:39:00.000Z,2023-01-31T23:59:59.999Z
30-01-2023,23774.64896664247,23789.347177699183,22657.582167625576,22840.13890737995,27205595568.34,440298767854.8,2023-01-30T00:00:00.000Z,2023-01-30T00:14:00.000Z,2023-01-30T22:43:00.000Z,2023-01-30T23:59:59.999Z
29-01-2023,23031.4492355484,23919.889761409202,22985.0701306067,23774.56592331162,27423687259.16,458291157032.27,2023-01-29T00:00:00.000Z,2023-01-29T19:49:00.000Z,2023-01-29T00:20:00.000Z,2023-01-29T23:59:59.999Z
28-01-2023,23079.96433256669,23165.895884287078,22908.846464031027,23031.08977562008,14712928379.05,443936922524.46,2023-01-28T00:00:00.000Z,2023-01-28T00:46:00.000Z,2023-01-28T13:22:00.000Z,2023-01-28T23:59:59.999Z
27-01-2023,23030.717285647723,23417.72097245481,22654.59340843538,23078.727879912283,25383335641.41,444830940521.37,2023-01-27T00:00:00.000Z,2023-01-27T20:10:00.000Z,2023-01-27T02:02:00.000Z,2023-01-27T23:59:59.999Z
26-01-2023,23108.954486797436,23237.07716893849,22911.373351233604,23032.777598708428,26357839322.09,443923229458.15,2023-01-26T00:00:00.000Z,2023-01-26T01:06:00.000Z,2023-01-26T16:13:00.000Z,2023-01-26T23:59:59.999Z
25-01-2023,22639.26716752375,23722.09880874052,22406.075502425076,23117.85968190475,30685366708.98,445539806080.32,2023-01-25T00:00:00.000Z,2023-01-25T22:08:00.000Z,2023-01-25T01:31:00.000Z,2023-01-25T23:59:59.999Z
24-01-2023,22929.627735671096,23134.012046600146,22549.74451310499,22636.469311191635,26405069714.63,436237993963.62,2023-01-24T00:00:00.000Z,2023-01-24T06:09:00.000Z,2023-01-24T23:23:00.000Z,2023-01-24T23:59:59.999Z
23-01-2023,22721.088671950587,23126.486345437213,22654.304469693496,22934.431464358633,26518700511.88,441960667796.84,2023-01-23T00:00:00.000Z,2023-01-23T18:41:00.000Z,2023-01-23T15:01:00.000Z,2023-01-23T23:59:59.999Z
22-01-2023,22777.986661421615,23056.72965007116,22387.900462859576,22720.41562863912,24746386230.08,437814457018.41,2023-01-22T00:00:00.000Z,2023-01-22T15:19:00.000Z,2023-01-22T21:22:00.000Z,2023-01-22T23:59:59.999Z
21-01-2023,22677.42738242082,23282.347721556718,22511.833134019824,22777.625809132605,32442278429.47,438896650641.24,2023-01-21T00:00:00.000Z,2023-01-21T19:56:00.000Z,2023-01-21T00:19:00.000Z,2023-01-21T23:59:59.999Z
20-01-2023,21085.37233777419,22692.35783082474,20919.125983682126,22676.55175888814,28799154319,436928964721.29,2023-01-20T00:00:00.000Z,2023-01-20T23:23:00.000Z,2023-01-20T08:34:00.000Z,2023-01-20T23:59:59.999Z
19-01-2023,20686.74590606124,21163.012288227077,20685.38118086059,21086.793304844312,21152848260.91,406279900295.03,2023-01-19T00:00:00.000Z,2023-01-19T20:28:00.000Z,2023-01-19T00:01:00.000Z,2023-01-19T23:59:59.999Z
18-01-2023,21161.050899700425,21564.502212963143,20541.54454877403,20688.780729864848,30005625417.91,398593008037.23,2023-01-18T00:00:00.000Z,2023-01-18T14:23:00.000Z,2023-01-18T16:47:00.000Z,2023-01-18T23:59:59.999Z
17-01-2023,21175.83326020336,21438.659357857345,20978.533624201336,21161.519219916157,24999983362.13,407681958151.49,2023-01-17T00:00:00.000Z,2023-01-17T14:26:00.000Z,2023-01-17T01:23:00.000Z,2023-01-17T23:59:59.999Z
16-01-2023,20882.22387661832,21360.87427947748,20715.74621411983,21169.6327806964,26792494049.72,407818156777.17,2023-01-16T00:00:00.000Z,2023-01-16T20:36:00.000Z,2023-01-16T15:16:00.000Z,2023-01-16T23:59:59.999Z
15-01-2023,20977.484195216995,20993.74869585351,20606.98723839924,20880.79920218209,19298407543.31,402234665331.34,2023-01-15T00:00:00.000Z,2023-01-15T17:29:00.000Z,2023-01-15T09:13:00.000Z,2023-01-15T23:59:59.999Z
14-01-2023,19910.53665706548,21075.141829957553,19907.828463560887,20976.299796392123,38967784639.05,404052157141.45,2023-01-14T00:00:00.000Z,2023-01-14T14:37:00.000Z,2023-01-14T00:04:00.000Z,2023-01-14T23:59:59.999Z
13-01-2023,18868.90593784208,19964.32272796427,18753.164262209666,19909.574624750632,29225029693.63,383483154873.96,2023-01-13T00:00:00.000Z,2023-01-13T22:44:00.000Z,2023-01-13T00:46:00.000Z,2023-01-13T23:59:59.999Z
12-01-2023,17944.068733941822,19030.087636638204,17919.231705835675,18869.588055265584,34971338710.34,363433455081.14,2023-01-12T00:00:00.000Z,2023-01-12T21:01:00.000Z,2023-01-12T00:03:06.000Z,2023-01-12T23:59:59.999Z
11-01-2023,17446.360272066515,17987.633549359143,17337.99499776178,17943.897629468323,18307186523.32,346303640718.24,2023-01-11T00:00:00.000Z,2023-01-11T23:38:06.000Z,2023-01-11T15:58:00.000Z,2023-01-11T23:59:59.999Z
10-01-2023,17192.95009444573,17484.720892404555,17162.99116698699,17446.292509299026,15808338948.79,335987993694.35,2023-01-10T00:00:00.000Z,2023-01-10T21:44:00.000Z,2023-01-10T02:43:00.000Z,2023-01-10T23:59:59.999Z
09-01-2023,17093.99249812248,17389.957551426294,17093.99249812248,17196.554059639464,18624736865.86,331160060320.4,2023-01-09T00:00:00.000Z,2023-01-09T18:34:00.000Z,2023-01-09T00:00:00.000Z,2023-01-09T23:59:59.999Z
08-01-2023,16954.145725849703,17091.14445130325,16924.050073925267,17091.14445130325,9768827914.24,329114546384.43,2023-01-08T00:00:00.000Z,2023-01-08T23:59:00.000Z,2023-01-08T00:43:00.000Z,2023-01-08T23:59:59.999Z
07-01-2023,16952.11698101385,16975.016620564034,16914.192080111883,16955.077435158768,7714767174.32,326478273136.7,2023-01-07T00:00:00.000Z,2023-01-07T01:04:00.000Z,2023-01-07T12:13:00.000Z,2023-01-07T23:59:59.999Z
06-01-2023,16836.473439155277,16991.99412117054,16716.422270521653,16951.969516629335,14413662912.72,326401273258.71,2023-01-06T00:00:00.000Z,2023-01-06T20:19:00.000Z,2023-01-06T13:14:00.000Z,2023-01-06T23:59:59.999Z
05-01-2023,16863.472056826773,16884.02211647721,16790.283040692182,16836.736645223573,13692758566.46,324163886549.58,2023-01-05T00:00:00.000Z,2023-01-05T00:21:00.000Z,2023-01-05T14:04:00.000Z,2023-01-05T23:59:59.999Z
04-01-2023,16680.204971419756,16964.585185463384,16667.763725134693,16863.238258283258,18421743322.29,324658229824.73,2023-01-04T00:00:00.000Z,2023-01-04T18:55:00.000Z,2023-01-04T00:50:00.000Z,2023-01-04T23:59:59.999Z
03-01-2023,16688.84726385924,16760.44746598456,16622.370328256326,16679.85707981374,13903079206.51,321111951654.75,2023-01-03T00:00:00.000Z,2023-01-03T06:32:00.000Z,2023-01-03T17:48:00.000Z,2023-01-03T23:59:59.999Z
02-01-2023,16625.51039411775,16759.344022918354,16572.228849744886,16688.47135739323,12097775226.69,321262452550.73,2023-01-02T00:00:00.000Z,2023-01-02T08:19:00.000Z,2023-01-02T01:19:00.000Z,2023-01-02T23:59:59.999Z
01-01-2023,16547.914397871536,16630.43900271543,16521.233430528962,16625.08055070908,9244361699.89,320025834692.4,2023-01-01T00:00:00.000Z,2023-01-01T23:18:00.000Z,2023-01-01T09:10:00.000Z,2023-01-01T23:59:59.999Z
31-12-2022,16603.67470264306,16628.986997303513,16517.519222395018,16547.49536601617,11239186456.23,318516317872.25,2022-12-31T00:00:00.000Z,2022-12-31T14:32:00.000Z,2022-12-31T23:13:00.000Z,2022-12-31T23:59:59.999Z
30-12-2022,16641.329824264532,16643.427409572592,16408.475176826076,16602.585155770088,15929162909.56,319559502979.58,2022-12-30T00:00:00.000Z,2022-12-30T00:45:00.000Z,2022-12-30T14:52:00.000Z,2022-12-30T23:59:59.999Z
29-12-2022,16552.322490686318,16651.75666380368,16508.683153231756,16642.342671885614,14472237478.79,320309344585.85,2022-12-29T00:00:00.000Z,2022-12-29T15:13:00.000Z,2022-12-29T02:33:00.000Z,2022-12-29T23:59:59.999Z
28-12-2022,16716.40022056822,16768.170355524755,16497.557038840765,16552.571736514474,17005713920.05,318567071312.32,2022-12-28T00:00:00.000Z,2022-12-28T15:06:00.000Z,2022-12-28T21:43:00.000Z,2022-12-28T23:59:59.999Z
27-12-2022,16919.291650123574,16959.846476047544,16642.073182208023,16717.17398012714,15748580239.21,321717198701.45,2022-12-27T00:00:00.000Z,2022-12-27T00:14:00.000Z,2022-12-27T19:20:00.000Z,2022-12-27T23:59:59.999Z
26-12-2022,16842.249310575324,16920.123640467442,16812.370075923343,16919.80517492847,11886957803.69,325604307791.2,2022-12-26T00:00:00.000Z,2022-12-26T23:58:00.000Z,2022-12-26T16:04:00.000Z,2022-12-26T23:59:59.999Z
25-12-2022,16847.505364105884,16860.553971121557,16755.253233558044,16841.98705228377,11656379938.06,324093186300.93,2022-12-25T00:00:00.000Z,2022-12-25T02:03:00.000Z,2022-12-25T19:28:00.000Z,2022-12-25T23:59:59.999Z
24-12-2022,16796.976619520563,16864.702878905566,16793.528184511397,16847.755265154647,9744636213.3,324190184505.64,2022-12-24T00:00:00.000Z,2022-12-24T19:16:00.000Z,2022-12-24T00:06:00.000Z,2022-12-24T23:59:59.999Z
23-12-2022,16829.643586035916,16905.219359989063,16794.459352221234,16796.952171216344,15329265212.56,323203056785.65,2022-12-23T00:00:00.000Z,2022-12-23T13:49:00.000Z,2022-12-23T01:05:00.000Z,2022-12-23T23:59:59.999Z
22-12-2022,16818.380287653727,16866.674326763485,16592.40745444739,16830.341423934446,16441573050.1,323831438044.37,2022-12-22T00:00:00.000Z,2022-12-22T09:47:00.000Z,2022-12-22T18:05:00.000Z,2022-12-22T23:59:59.999Z
21-12-2022,16904.527354049867,16916.79988236787,16755.91221318602,16817.53438655099,14882945044.81,323570505189.58,2022-12-21T00:00:00.000Z,2022-12-21T00:10:00.000Z,2022-12-21T20:13:00.000Z,2022-12-21T23:59:59.999Z
20-12-2022,16441.786800099886,17012.984705296407,16427.867238763847,16906.30521042145,22722096614.76,325263465984.55,2022-12-20T00:00:00.000Z,2022-12-20T15:34:00.000Z,2022-12-20T00:15:00.000Z,2022-12-20T23:59:59.999Z
19-12-2022,16759.04092682387,16807.526574065127,16398.136251675314,16439.679646162964,17221074813.55,316271488936.78,2022-12-19T00:00:00.000Z,2022-12-19T00:32:00.000Z,2022-12-19T22:37:00.000Z,2022-12-19T23:59:59.999Z
18-12-2022,16795.6092258732,16815.386575543896,16697.82003455788,16757.977403246638,10924354698.17,322379914497.22,2022-12-18T00:00:00.000Z,2022-12-18T23:16:00.000Z,2022-12-18T15:16:00.000Z,2022-12-18T23:59:59.999Z
17-12-2022,16646.982567247887,16800.590192749856,16614.02894738076,16795.09096721353,14463581825.22,323078968931.9,2022-12-17T00:00:00.000Z,2022-12-17T23:57:00.000Z,2022-12-17T02:29:00.000Z,2022-12-17T23:59:59.999Z
16-12-2022,17364.546443268817,17505.5250524957,16584.70139828051,16647.48347882862,24031608959.5,320225997953.71,2022-12-16T00:00:00.000Z,2022-12-16T08:03:00.000Z,2022-12-16T23:35:00.000Z,2022-12-16T23:59:59.999Z
15-12-2022,17813.644122701808,17846.744460573012,17322.590067121728,17364.864911262914,20964448340.77,334010450284.36,2022-12-15T00:00:00.000Z,2022-12-15T00:34:00.000Z,2022-12-15T23:41:00.000Z,2022-12-15T23:59:59.999Z
14-12-2022,17782.066878037138,18318.53058436097,17652.09831268358,17652.09831268358,25900123362.05,339521782853.53,2022-12-14T00:00:00.000Z,2022-12-14T18:58:00.000Z,2022-12-15T01:59:00.000Z,2022-12-14T23:59:59.999Z
13-12-2022,17206.440483921902,17930.086838900843,17111.76315246234,17781.318835459824,26634741631.05,341988994228.35,2022-12-13T00:00:00.000Z,2022-12-13T14:23:00.000Z,2022-12-13T07:22:00.000Z,2022-12-13T23:59:59.999Z
12-12-2022,17102.50064945091,17212.56387663098,16899.39378501017,17206.438300671838,19617581340.83,330914961275.37,2022-12-12T00:00:00.000Z,2022-12-12T23:53:00.000Z,2022-12-12T03:05:00.000Z,2022-12-12T23:59:59.999Z
11-12-2022,17129.71133330881,17245.635283908436,17091.819989740216,17104.192805716193,14122486832.21,328933297475.65,2022-12-11T00:00:00.000Z,2022-12-11T19:13:00.000Z,2022-12-11T23:48:00.000Z,2022-12-11T23:59:59.999Z
10-12-2022,17134.221365280508,17216.82559261347,17120.684322763056,17128.723710215563,12706781968.8,329389313682.63,2022-12-10T00:00:00.000Z,2022-12-10T16:04:00.000Z,2022-12-10T23:53:00.000Z,2022-12-10T23:59:59.999Z
09-12-2022,17232.148002630023,17280.546164948628,17100.836249754095,17133.1520141413,20328426366.41,329458400093.47,2022-12-09T00:00:00.000Z,2022-12-09T12:43:00.000Z,2022-12-09T21:36:00.000Z,2022-12-09T23:59:59.999Z
08-12-2022,16847.350249703974,17267.91576301951,16788.783823541482,17233.474019915124,20496603769.86,331370511897.98,2022-12-08T00:00:00.000Z,2022-12-08T20:06:00.000Z,2022-12-08T11:49:00.000Z,2022-12-08T23:59:59.999Z
07-12-2022,17089.506270186645,17109.377493895725,16750.55813442861,16848.127628900518,19675404388.75,323943465219.08,2022-12-07T00:00:00.000Z,2022-12-07T00:43:00.000Z,2022-12-07T08:06:00.000Z,2022-12-07T23:59:59.999Z
06-12-2022,16975.23912418603,17091.86417510719,16939.922348926935,17089.503706009797,19889922369.03,328566216152.49,2022-12-06T00:00:00.000Z,2022-12-06T23:37:00.000Z,2022-12-06T18:34:00.000Z,2022-12-06T23:59:59.999Z
05-12-2022,17128.894080449645,17378.15331028325,16922.431868759784,16974.825665133598,22209086834.09,326346115859.9,2022-12-05T00:00:00.000Z,2022-12-05T05:09:00.000Z,2022-12-05T19:35:00.000Z,2022-12-05T23:59:59.999Z
04-12-2022,16908.170477079635,17157.767239586625,16903.439827645885,17130.485947216774,16824520830.08,329323845088.74,2022-12-04T00:00:00.000Z,2022-12-04T23:35:00.000Z,2022-12-04T00:02:00.000Z,2022-12-04T23:59:59.999Z
03-12-2022,17090.098485075916,17116.04080553255,16888.140807160373,16908.236795124038,16217776703.79,325037180854.75,2022-12-03T00:00:00.000Z,2022-12-03T00:07:00.000Z,2022-12-03T22:47:00.000Z,2022-12-03T23:59:59.999Z
02-12-2022,16968.683261479262,17088.660409402313,16877.88159587772,17088.660409402313,19539705127.46,328491679165.28,2022-12-02T00:00:00.000Z,2022-12-02T23:59:00.000Z,2022-12-02T14:09:00.000Z,2022-12-02T23:59:59.999Z
01-12-2022,17168.002137625317,17197.49725344472,16888.38788761444,16967.13366710075,22895392882.21,326142124579.08,2022-12-01T00:00:00.000Z,2022-12-01T13:35:00.000Z,2022-12-01T21:10:00.000Z,2022-12-01T23:59:59.999Z
30-11-2022,16445.47748855228,17190.93827300782,16445.47748855228,17168.56554848644,29523576583.08,329997633644.39,2022-11-30T00:00:00.000Z,2022-11-30T23:46:00.000Z,2022-11-30T00:00:00.000Z,2022-11-30T23:59:59.999Z
29-11-2022,16217.639903770933,16522.257470665474,16139.396275247083,16444.98327002905,23581685467.5,316074930082.57,2022-11-29T00:00:00.000Z,2022-11-29T11:25:00.000Z,2022-11-29T00:20:00.000Z,2022-11-29T23:59:59.999Z
28-11-2022,16440.222087898794,16482.933543310384,16054.53021534078,16217.322467641055,27743025156.05,311686396568.46,2022-11-28T00:00:00.000Z,2022-11-28T00:28:00.000Z,2022-11-28T16:22:00.000Z,2022-11-28T23:59:59.999Z
27-11-2022,16463.883171590274,16594.405472441995,16437.02533441152,16444.626834548457,20443898508.94,316040534591.72,2022-11-27T00:00:00.000Z,2022-11-27T22:08:00.000Z,2022-11-27T23:46:00.000Z,2022-11-27T23:59:59.999Z
26-11-2022,16521.577024910126,16666.862927005834,16416.228690260028,16464.281079365555,18000008764.22,316404791284.87,2022-11-26T00:00:00.000Z,2022-11-26T01:29:00.000Z,2022-11-26T22:50:00.000Z,2022-11-26T23:59:59.999Z
25-11-2022,16602.269516497403,16603.31699288261,16388.40495351409,16521.84101896077,18678255975.67,317499392769.32,2022-11-25T00:00:00.000Z,2022-11-25T00:09:00.000Z,2022-11-25T06:02:00.000Z,2022-11-25T23:59:59.999Z
24-11-2022,16611.637672358618,16771.47524317893,16501.76805488462,16604.46501795427,26129037414.48,319074189335.14,2022-11-24T00:00:00.000Z,2022-11-24T02:04:00.000Z,2022-11-24T14:22:00.000Z,2022-11-24T23:59:59.999Z
23-11-2022,16195.588669774414,16638.19248653868,16170.502495775037,16610.7064149352,32958875628.23,319180537510.23,2022-11-23T00:00:00.000Z,2022-11-23T19:07:00.000Z,2022-11-23T01:08:00.000Z,2022-11-23T23:59:59.999Z
22-11-2022,15782.301230536288,16253.047746702146,15656.606060116139,16189.769531934091,30726828760.3,311078520948.59,2022-11-22T00:00:00.000Z,2022-11-22T16:04:00.000Z,2022-11-22T07:04:00.000Z,2022-11-22T23:59:59.999Z
21-11-2022,16291.223799578982,16291.223799578982,15599.047175382899,15787.284094521752,37429485517.93,303332140406.92,2022-11-21T00:00:00.000Z,2022-11-21T00:00:00.000Z,2022-11-21T21:53:00.000Z,2022-11-21T23:59:59.999Z
20-11-2022,16712.920458367662,16746.780157269564,16248.692829299347,16291.8324676929,21313378651.69,313012826679.9,2022-11-20T00:00:00.000Z,2022-11-20T01:05:00.000Z,2022-11-20T22:05:00.000Z,2022-11-20T23:59:59.999Z
19-11-2022,16696.219905182574,16797.87699736105,16570.410748351132,16711.547793796504,16106223491.51,321061621175.61,2022-11-19T00:00:00.000Z,2022-11-19T22:41:00.000Z,2022-11-19T05:23:00.000Z,2022-11-19T23:59:59.999Z
18-11-2022,16687.911575071244,16947.05840111188,16564.61168003081,16697.77766778654,26862218608.57,320781106962.52,2022-11-18T00:00:00.000Z,2022-11-18T01:04:00.000Z,2022-11-18T18:25:00.000Z,2022-11-18T23:59:59.999Z
17-11-2022,16670.426756200326,16726.438844788194,16460.68348704278,16687.51795054106,27868914021.95,320570440520.86,2022-11-17T00:00:00.000Z,2022-11-17T01:18:00.000Z,2022-11-17T04:13:00.000Z,2022-11-17T23:59:59.999Z
16-11-2022,16884.341187944265,16960.29517836233,16430.111281780155,16669.44014477405,33925512988.62,320208159886.93,2022-11-16T00:00:00.000Z,2022-11-16T03:44:00.000Z,2022-11-16T16:04:00.000Z,2022-11-16T23:59:59.999Z
15-11-2022,16617.484737989726,17051.96196720474,16542.55126721595,16884.613907054605,36599436182.62,324326299579.98,2022-11-15T00:00:00.000Z,2022-11-15T15:46:00.000Z,2022-11-15T01:04:00.000Z,2022-11-15T23:59:59.999Z
14-11-2022,16352.028563420386,17109.323354054974,15872.941612674758,16618.199228890797,49630243054.06,319192915033.18,2022-11-14T00:00:00.000Z,2022-11-14T13:31:00.000Z,2022-11-14T06:01:00.000Z,2022-11-14T23:59:59.999Z
13-11-2022,16799.722291055714,16920.766400155015,16320.635153276064,16353.365717176099,27209183682.26,314093257178.25,2022-11-13T00:00:00.000Z,2022-11-13T04:07:00.000Z,2022-11-13T23:47:00.000Z,2022-11-13T23:59:59.999Z
12-11-2022,17036.875408441774,17066.675491252296,16651.774769724314,16799.184738399876,29717699419.42,322642084634.09,2022-11-12T00:00:00.000Z,2022-11-12T00:04:00.000Z,2022-11-12T05:56:00.000Z,2022-11-12T23:59:59.999Z
11-11-2022,17583.252430510052,17650.94405254207,16543.482390135327,17034.29313471333,55871616488.33,327139766936.22,2022-11-11T00:00:00.000Z,2022-11-11T01:22:00.000Z,2022-11-11T14:32:00.000Z,2022-11-11T23:59:59.999Z
10-11-2022,15883.15822691518,18054.311779066138,15834.018093252147,17586.77144954725,83202283720.96,337735690619.8,2022-11-10T00:00:00.000Z,2022-11-10T21:01:00.000Z,2022-11-10T00:05:00.000Z,2022-11-10T23:59:59.999Z
09-11-2022,18543.761249619893,18590.459569580897,15682.692842780652,15880.779849172332,102905151606.28,304958504278.2,2022-11-09T00:00:00.000Z,2022-11-09T00:34:00.000Z,2022-11-09T23:38:00.000Z,2022-11-09T23:59:59.999Z
08-11-2022,20600.67274715879,20664.60652029959,17603.54436900462,18541.271853223814,118992465606.57,356030188152.67,2022-11-08T00:00:00.000Z,2022-11-08T02:31:00.000Z,2022-11-08T19:35:00.000Z,2022-11-08T23:59:59.999Z
07-11-2022,20924.62048404909,21053.246149529263,20489.973343695598,20602.816725269906,53510852236.18,395596352770.07,2022-11-07T00:00:00.000Z,2022-11-07T02:18:00.000Z,2022-11-07T22:33:00.000Z,2022-11-07T23:59:59.999Z
06-11-2022,21285.056663911386,21345.37679278884,20920.19068403618,20926.485973821505,35082693210.3,401792318391.34,2022-11-06T00:00:00.000Z,2022-11-06T00:41:00.000Z,2022-11-06T23:58:00.000Z,2022-11-06T23:59:59.999Z
05-11-2022,21144.83146578881,21446.886096690843,21097.635417108453,21282.69129591641,37846047609.23,408613690153.42,2022-11-05T00:00:00.000Z,2022-11-05T04:22:00.000Z,2022-11-05T00:18:00.000Z,2022-11-05T23:59:59.999Z
04-11-2022,20208.7694981217,21209.561042305395,20188.0187146493,21147.229732238487,64072727949.72,405992446610.67,2022-11-04T00:00:00.000Z,2022-11-04T15:02:00.000Z,2022-11-04T00:12:00.000Z,2022-11-04T23:59:59.999Z
03-11-2022,20162.689227896553,20382.096320645098,20086.24090339057,20209.987415003863,43228750179.43,387983112928.37,2022-11-03T00:00:00.000Z,2022-11-03T05:53:00.000Z,2022-11-03T12:51:00.000Z,2022-11-03T23:59:59.999Z
02-11-2022,20482.959693755372,20742.811011066202,20087.134483620648,20159.503067104524,55552169483.42,386993271473.89,2022-11-02T00:00:00.000Z,2022-11-02T18:32:00.000Z,2022-11-02T22:56:00.000Z,2022-11-02T23:59:59.999Z
01-11-2022,20494.897622939236,20647.289720357683,20359.845479716354,20485.273243090294,39819303159.15,393230695987.89,2022-11-01T00:00:00.000Z,2022-11-01T09:50:00.000Z,2022-11-01T14:14:00.000Z,2022-11-01T23:59:59.999Z
31-10-2022,20633.696071095317,20795.321223177747,20287.459087988613,20495.774232032527,45668466815.41,393413045572.67,2022-10-31T00:00:00.000Z,2022-10-31T11:20:00.000Z,2022-10-31T14:40:00.000Z,2022-10-31T23:59:59.999Z
30-10-2022,20817.982251842404,20917.006239851922,20547.46342477446,20635.603747684276,31486345555.64,396075135322.21,2022-10-30T00:00:00.000Z,2022-10-30T07:15:00.000Z,2022-10-30T22:32:00.000Z,2022-10-30T23:59:59.999Z
29-10-2022,20595.103841969667,20988.394470423613,20566.484616724767,20818.47616443884,40369840645.23,399567972100.27,2022-10-29T00:00:00.000Z,2022-10-29T10:24:00.000Z,2022-10-29T00:41:00.000Z,2022-10-29T23:59:59.999Z
28-10-2022,20287.956094786256,20724.98029964302,20086.06823011306,20595.35193660123,43994715910.3,395266756395.28,2022-10-28T00:00:00.000Z,2022-10-28T16:58:00.000Z,2022-10-28T08:25:00.000Z,2022-10-28T23:59:59.999Z
27-10-2022,20772.803027102687,20854.044215933114,20255.373144335506,20285.836775701682,49625110402.03,389306507854.33,2022-10-27T00:00:00.000Z,2022-10-27T05:46:00.000Z,2022-10-27T23:17:00.000Z,2022-10-27T23:59:59.999Z
26-10-2022,20092.23718809519,20938.133812687523,20076.11777157532,20770.441271629403,58895950537.09,398588922090.83,2022-10-26T00:00:00.000Z,2022-10-26T16:14:00.000Z,2022-10-26T00:15:00.000Z,2022-10-26T23:59:59.999Z
25-10-2022,19344.96442021395,20348.41158417784,19261.44712585322,20095.85645544717,47761524909.94,385624152241.56,2022-10-25T00:00:00.000Z,2022-10-25T18:37:00.000Z,2022-10-25T10:04:00.000Z,2022-10-25T23:59:59.999Z
24-10-2022,19567.769580384924,19589.124575528083,19206.324306708124,19345.57234828513,30202235804.59,371211779873.32,2022-10-24T00:00:00.000Z,2022-10-24T00:34:00.000Z,2022-10-24T14:28:00.000Z,2022-10-24T23:59:59.999Z
23-10-2022,19207.734650775248,19646.651541546595,19124.19696484497,19567.00739805294,22128794335.13,375444263357.02,2022-10-23T00:00:00.000Z,2022-10-23T22:37:00.000Z,2022-10-23T12:28:00.000Z,2022-10-23T23:59:59.999Z
22-10-2022,19172.380608580974,19248.067672211775,19132.243193413342,19208.190246004346,16104440957.47,368541303588.26,2022-10-22T00:00:00.000Z,2022-10-22T15:05:00.000Z,2022-10-22T03:06:00.000Z,2022-10-22T23:59:59.999Z
21-10-2022,19053.203045616505,19237.385606151693,18770.97006051153,19172.46921726924,32459287865.69,367839754255.23,2022-10-21T00:00:00.000Z,2022-10-21T19:52:00.000Z,2022-10-21T12:26:00.000Z,2022-10-21T23:59:59.999Z
20-10-2022,19138.08505687014,19315.19896864566,18971.458649274926,19053.740240536765,24493974419.53,365543015077.49,2022-10-20T00:00:00.000Z,2022-10-20T15:02:00.000Z,2022-10-20T01:07:00.000Z,2022-10-20T23:59:59.999Z
19-10-2022,19335.02644145188,19348.416809620576,19127.688369957425,19139.534351389357,22425387183.91,367171621206.39,2022-10-19T00:00:00.000Z,2022-10-19T00:07:00.000Z,2022-10-19T23:52:00.000Z,2022-10-19T23:59:59.999Z
18-10-2022,19550.466742932043,19666.995005967685,19144.770176278835,19334.41514998285,30580012344.21,370891718468.24,2022-10-18T00:00:00.000Z,2022-10-18T06:46:00.000Z,2022-10-18T19:28:00.000Z,2022-10-18T23:59:59.999Z
17-10-2022,19268.562102307453,19635.802281363132,19173.33472358563,19550.75729991318,27472552998.34,375024092833.74,2022-10-17T00:00:00.000Z,2022-10-17T13:45:00.000Z,2022-10-17T04:12:00.000Z,2022-10-17T23:59:59.999Z
16-10-2022,19068.91355993786,19389.6035200638,19068.91355993786,19268.092800861934,17988916650.36,369584293835.81,2022-10-16T00:00:00.000Z,2022-10-16T20:04:00.000Z,2022-10-16T00:00:00.000Z,2022-10-16T23:59:59.999Z
15-10-2022,19185.437303811446,19212.54160761659,19019.250125219165,19067.635082288427,16192235531.97,365722351004.5,2022-10-15T00:00:00.000Z,2022-10-15T03:59:00.000Z,2022-10-15T23:04:00.000Z,2022-10-15T23:59:59.999Z
14-10-2022,19382.53397217804,19889.146270975412,19115.407318499372,19185.65670032703,38452356726.7,367967465552.59,2022-10-14T00:00:00.000Z,2022-10-14T01:58:00.000Z,2022-10-14T22:14:00.000Z,2022-10-14T23:59:59.999Z
13-10-2022,19156.96661332697,19453.32797149125,18319.822629614115,19382.904033633087,44219840003.89,371731749298.26,2022-10-13T00:00:00.000Z,2022-10-13T20:24:00.000Z,2022-10-13T13:20:00.000Z,2022-10-13T23:59:59.999Z
12-10-2022,19052.64578600759,19203.198651051654,19029.758329129058,19157.446286852537,24950173846.05,367391447229.96,2022-10-12T00:00:00.000Z,2022-10-12T22:14:00.000Z,2022-10-12T12:39:00.000Z,2022-10-12T23:59:59.999Z
11-10-2022,19138.999877483147,19241.96023569531,18925.603221817615,19051.41826947727,28711532910.3,365340817941.08,2022-10-11T00:00:00.000Z,2022-10-11T12:37:00.000Z,2022-10-11T14:07:00.000Z,2022-10-11T23:59:59.999Z
10-10-2022,19446.416225133773,19515.467287660194,19102.979239623415,19141.483505012173,27425022773.59,367049182259.43,2022-10-10T00:00:00.000Z,2022-10-10T01:58:00.000Z,2022-10-10T22:19:00.000Z,2022-10-10T23:59:59.999Z
09-10-2022,19417.479411166132,19542.538653542095,19349.25895339935,19446.426194132677,16837262532.25,372876821416.38,2022-10-09T00:00:00.000Z,2022-10-09T16:08:00.000Z,2022-10-09T04:29:00.000Z,2022-10-09T23:59:59.999Z
08-10-2022,19546.328837739784,19601.695455117493,19299.41361902811,19416.567849523348,16437423166.71,372284398575.26,2022-10-08T00:00:00.000Z,2022-10-08T00:28:00.000Z,2022-10-08T22:08:00.000Z,2022-10-08T23:59:59.999Z
07-10-2022,19957.55908041741,20041.085579829185,19395.79324021193,19546.849710149883,29227315390.11,374761116006.47,2022-10-07T00:00:00.000Z,2022-10-07T02:44:00.000Z,2022-10-07T17:12:00.000Z,2022-10-07T23:59:59.999Z
06-10-2022,20161.03843820979,20408.391839881628,19900.088532978476,19955.443672368598,34711412966.17,382574032285.78,2022-10-06T00:00:00.000Z,2022-10-06T02:11:00.000Z,2022-10-06T23:05:00.000Z,2022-10-06T23:59:59.999Z
05-10-2022,20335.899579376473,20343.748520269062,19801.800661202462,20160.716171606804,33223790572.36,386489739242.67,2022-10-05T00:00:00.000Z,2022-10-05T00:05:00.000Z,2022-10-05T14:37:00.000Z,2022-10-05T23:59:59.999Z
04-10-2022,19623.584689448744,20380.344182520283,19523.840123958253,20336.842949206013,35887278684.83,389843287588.34,2022-10-04T00:00:00.000Z,2022-10-04T20:52:00.000Z,2022-10-04T02:15:00.000Z,2022-10-04T23:59:59.999Z
03-10-2022,19044.067849811498,19653.542952904896,19025.226285446846,19623.580334555998,30484729488.71,376151028151.32,2022-10-03T00:00:00.000Z,2022-10-03T23:28:00.000Z,2022-10-03T00:08:00.000Z,2022-10-03T23:59:59.999Z
02-10-2022,19311.848708225836,19370.309280933485,18970.620583252872,19044.107272371097,20765955327.49,365024821953.69,2022-10-02T00:00:00.000Z,2022-10-02T05:35:00.000Z,2022-10-02T23:37:00.000Z,2022-10-02T23:59:59.999Z
01-10-2022,19431.10494591723,19471.15486711021,19231.0818744273,19312.094732131416,18719537669.88,370142714486.9,2022-10-01T00:00:00.000Z,2022-10-01T00:22:00.000Z,2022-10-01T20:13:00.000Z,2022-10-01T23:59:59.999Z
30-09-2022,19573.431421230798,20109.85030130757,19265.66239970878,19431.78944659943,43975248084.73,372414733487.45,2022-09-30T00:00:00.000Z,2022-09-30T15:13:00.000Z,2022-09-30T13:31:00.000Z,2022-09-30T23:59:59.999Z
29-09-2022,19427.780190523128,19589.26621148917,18924.353453070675,19573.05031400065,41037843771.3,375100872175.06,2022-09-29T00:00:00.000Z,2022-09-29T04:59:00.000Z,2022-09-29T14:19:00.000Z,2022-09-29T23:59:59.999Z
28-09-2022,19104.620789502645,19688.344373336102,18553.297357607673,19426.721331678913,53071298733.51,372279603227.33,2022-09-28T00:00:00.000Z,2022-09-28T21:31:00.000Z,2022-09-28T02:44:00.000Z,2022-09-28T23:59:59.999Z
27-09-2022,19221.84071275122,20338.455461136455,18915.668722274404,19110.546550991752,58571439618.96,366202733264.3,2022-09-27T00:00:00.000Z,2022-09-27T12:52:00.000Z,2022-09-27T18:25:00.000Z,2022-09-27T23:59:59.999Z
26-09-2022,18803.90063289787,19274.87349825737,18721.285851353183,19222.67218417039,44148798320.6,368335944295.86,2022-09-26T00:00:00.000Z,2022-09-26T09:05:00.000Z,2022-09-26T07:01:00.000Z,2022-09-26T23:59:59.999Z
25-09-2022,18936.31151524196,19134.73319426829,18696.46830381677,18802.097975676545,23359966112.45,360259346858.07,2022-09-25T00:00:00.000Z,2022-09-25T11:53:00.000Z,2022-09-25T22:07:00.000Z,2022-09-25T23:59:59.999Z
24-09-2022,19296.990703569038,19310.19760761166,18861.973998958467,18937.01117567154,26149643167.68,362826506171.96,2022-09-24T00:00:00.000Z,2022-09-24T00:08:00.000Z,2022-09-24T22:53:00.000Z,2022-09-24T23:59:59.999Z
23-09-2022,19412.39992542163,19464.67234839256,18617.55300989774,19297.637840008694,38896078052.07,369718966324.75,2022-09-23T00:00:00.000Z,2022-09-23T04:56:00.000Z,2022-09-23T14:26:00.000Z,2022-09-23T23:59:59.999Z
22-09-2022,18534.64959547727,19456.91090106223,18415.591496855097,19413.55162082187,41135767926.23,371923967755.44,2022-09-22T00:00:00.000Z,2022-09-22T23:11:00.000Z,2022-09-22T01:00:00.000Z,2022-09-22T23:59:59.999Z
21-09-2022,18891.282889531798,19674.630331478547,18290.31518822502,18547.39975982615,46363793974.56,355314855623.96,2022-09-21T00:00:00.000Z,2022-09-21T18:01:00.000Z,2022-09-21T22:20:00.000Z,2022-09-21T23:59:59.999Z
20-09-2022,19545.591275415263,19602.45674588385,18813.455010972895,18890.78909636913,36791346508.26,361876433047.07,2022-09-20T00:00:00.000Z,2022-09-20T00:11:00.000Z,2022-09-20T18:01:00.000Z,2022-09-20T23:59:59.999Z
19-09-2022,19418.571421509565,19639.47973254867,18390.3187095743,19544.12924967429,40177002623.56,374373522207.39,2022-09-19T00:00:00.000Z,2022-09-19T22:58:00.000Z,2022-09-19T06:46:00.000Z,2022-09-19T23:59:59.999Z
18-09-2022,20127.23394762749,20127.23394762749,19387.491347831052,19419.506190766973,31254779143.63,371970445843.4,2022-09-18T00:00:00.000Z,2022-09-18T00:00:00.000Z,2022-09-18T22:32:00.000Z,2022-09-18T23:59:59.999Z
17-09-2022,19777.03402833151,20162.532021771345,19777.03402833151,20127.576657178884,24957448100.3,385513277844.78,2022-09-17T00:00:00.000Z,2022-09-17T17:11:00.000Z,2022-09-17T00:00:00.000Z,2022-09-17T23:59:59.999Z
16-09-2022,19704.005440526256,19870.62976581665,19400.075449303535,19772.58420556779,30123362272.94,378693173324.34,2022-09-16T00:00:00.000Z,2022-09-16T11:59:00.000Z,2022-09-16T17:31:00.000Z,2022-09-16T23:59:59.999Z
15-09-2022,20242.289908387913,20318.166391880794,19636.733774286808,19701.209962566052,36389011503.32,377311288517.09,2022-09-15T00:00:00.000Z,2022-09-15T07:22:00.000Z,2022-09-15T15:19:00.000Z,2022-09-15T23:59:59.999Z
14-09-2022,20184.555325164954,20467.201432782444,19793.396718166267,20241.089801830654,37872380889,387631908834.78,2022-09-14T00:00:00.000Z,2022-09-14T02:27:00.000Z,2022-09-14T18:19:00.000Z,2022-09-14T23:59:59.999Z
13-09-2022,22371.48063978407,22673.819766285604,20062.670699488786,20296.70781387527,51091116621.52,388682319976.46,2022-09-13T00:00:00.000Z,2022-09-13T12:26:00.000Z,2022-09-13T21:46:00.000Z,2022-09-13T23:59:59.999Z
12-09-2022,21770.14813305873,22439.181008979318,21603.895779278708,22370.448649932,50212088965.2,428373958242.42,2022-09-12T00:00:00.000Z,2022-09-12T14:26:00.000Z,2022-09-12T03:43:00.000Z,2022-09-12T23:59:59.999Z
11-09-2022,21678.543569706628,21770.55319063439,21406.944641111553,21769.256339556683,34493951963.3,416840289162.08,2022-09-11T00:00:00.000Z,2022-09-11T23:58:00.000Z,2022-09-11T06:43:00.000Z,2022-09-11T23:59:59.999Z
10-09-2022,21376.91171453879,21760.275770575212,21168.721721800943,21680.53941342801,36913738894.15,415117548315.38,2022-09-10T00:00:00.000Z,2022-09-10T23:39:00.000Z,2022-09-10T14:04:00.000Z,2022-09-10T23:59:59.999Z
09-09-2022,19328.139929463316,21439.409317162346,19310.962575438858,21381.15285528657,48469528170.65,409363809141.16,2022-09-09T00:00:00.000Z,2022-09-09T23:19:00.000Z,2022-09-09T00:07:00.000Z,2022-09-09T23:59:59.999Z
08-09-2022,19289.940569121,19417.35159322524,19076.714523463485,19329.834933426577,32194477849.95,370071738762.96,2022-09-08T00:00:00.000Z,2022-09-08T20:17:00.000Z,2022-09-08T13:13:00.000Z,2022-09-08T23:59:59.999Z
07-09-2022,18837.683320773453,19427.172670784956,18644.467227058507,19290.32387359376,35239757133.88,369299496559.04,2022-09-07T00:00:00.000Z,2022-09-07T21:07:00.000Z,2022-09-07T03:03:00.000Z,2022-09-07T23:59:59.999Z
06-09-2022,19817.724065572373,20155.268716860086,18800.171655066068,18837.66771237502,43403978910.41,360616650169.4,2022-09-06T00:00:00.000Z,2022-09-06T01:05:00.000Z,2022-09-06T20:13:00.000Z,2022-09-06T23:59:59.999Z
05-09-2022,19988.789818433175,20031.160251574245,19673.04733875358,19812.37147875423,28813460025.44,379258182345.46,2022-09-05T00:00:00.000Z,2022-09-05T00:05:00.000Z,2022-09-05T11:33:00.000Z,2022-09-05T23:59:59.999Z
04-09-2022,19832.47129556646,19999.689645047867,19636.81657365489,19986.713839219963,25245861651.62,382576542382.13,2022-09-04T00:00:00.000Z,2022-09-04T23:43:00.000Z,2022-09-04T08:04:00.000Z,2022-09-04T23:59:59.999Z
03-09-2022,19969.718346916892,20037.010648596926,19698.35519233295,19832.08772933853,23613051457.08,379595440556.6,2022-09-03T00:00:00.000Z,2022-09-03T00:46:00.000Z,2022-09-03T19:19:00.000Z,2022-09-03T23:59:59.999Z
02-09-2022,20126.072780901522,20401.56763327601,19814.766048983613,19969.771177460185,29123998927.55,382212933183.84,2022-09-02T00:00:00.000Z,2022-09-02T14:44:00.000Z,2022-09-02T18:16:00.000Z,2022-09-02T23:59:59.999Z
01-09-2022,20050.498669841865,20198.391198499645,19653.968458882307,20127.140269430896,30182031009.86,385208305831.58,2022-09-01T00:00:00.000Z,2022-09-01T02:28:00.000Z,2022-09-01T16:42:00.000Z,2022-09-01T23:59:59.999Z
31-08-2022,19799.581315787203,20420.990420175203,19799.581315787203,20049.76318937261,33225232872.06,383710102294.98,2022-08-31T00:00:00.000Z,2022-08-31T04:07:00.000Z,2022-08-31T00:00:00.000Z,2022-08-31T23:59:59.999Z
30-08-2022,20298.61208082999,20542.644969647983,19617.64095004422,19796.80940241047,34483360282.77,378850670474.32,2022-08-30T00:00:00.000Z,2022-08-30T07:36:00.000Z,2022-08-30T17:24:00.000Z,2022-08-30T23:59:59.999Z
29-08-2022,19615.153362859797,20357.463233457594,19600.785034825636,20297.994635306477,32637854077.72,388422039679.33,2022-08-29T00:00:00.000Z,2022-08-29T16:07:00.000Z,2022-08-29T00:22:00.000Z,2022-08-29T23:59:59.999Z
28-08-2022,20041.03480395418,20139.05423328289,19616.814984443863,19616.814984443863,24366810590.82,375367382007.85,2022-08-28T00:00:00.000Z,2022-08-28T16:28:00.000Z,2022-08-28T23:59:00.000Z,2022-08-28T23:59:59.999Z
27-08-2022,20262.480311022402,20340.774563673953,19890.523328250318,20041.73845305508,30116729775.56,383478483268.59,2022-08-27T00:00:00.000Z,2022-08-27T00:37:00.000Z,2022-08-27T16:29:00.000Z,2022-08-27T23:59:59.999Z
26-08-2022,21596.085314556974,21804.908008099064,20199.48338389128,20260.018649424077,42326789563.56,387636192940.59,2022-08-26T00:00:00.000Z,2022-08-26T13:07:00.000Z,2022-08-26T23:50:00.000Z,2022-08-26T23:59:59.999Z
25-08-2022,21395.458389989148,21789.636836285154,21362.441259908275,21600.905141669937,31028679593,413267825941.47,2022-08-25T00:00:00.000Z,2022-08-25T08:13:00.000Z,2022-08-25T00:17:00.000Z,2022-08-25T23:59:59.999Z
24-08-2022,21526.455593085484,21783.07572274634,21195.006694910768,21395.02007149252,31962253368.02,409308514098.09,2022-08-24T00:00:00.000Z,2022-08-24T19:42:00.000Z,2022-08-24T03:16:00.000Z,2022-08-24T23:59:59.999Z
23-08-2022,21401.045669959727,21646.203761836543,20955.138156081837,21528.08737168398,31878280659.1,411833237128.08,2022-08-23T00:00:00.000Z,2022-08-23T14:13:00.000Z,2022-08-23T06:14:00.000Z,2022-08-23T23:59:59.999Z
22-08-2022,21531.46384880662,21531.46384880662,20939.18417270787,21398.9083503016,31666498757.58,409340103013.27,2022-08-22T00:00:00.000Z,2022-08-22T00:00:00.000Z,2022-08-22T08:34:00.000Z,2022-08-22T23:59:59.999Z
21-08-2022,21160.392783176445,21668.84590773835,21103.196808425557,21534.121230814173,23102307723.19,411906673576.29,2022-08-21T00:00:00.000Z,2022-08-21T21:25:00.000Z,2022-08-21T06:58:00.000Z,2022-08-21T23:59:59.999Z
20-08-2022,20872.842173501398,21350.806299165055,20856.731335579087,21166.060396104986,27595671000.41,404848126556.26,2022-08-20T00:00:00.000Z,2022-08-20T07:43:00.000Z,2022-08-20T21:03:00.000Z,2022-08-20T23:59:59.999Z
19-08-2022,23213.31324159989,23213.31324159989,20868.84743863899,20877.553692219353,40509610259.78,399309311305.82,2022-08-19T00:00:00.000Z,2022-08-19T00:00:00.000Z,2022-08-19T23:56:00.000Z,2022-08-19T23:59:59.999Z
18-08-2022,23341.038978010583,23563.831593730618,23177.602469968748,23212.739077042832,23747613147.14,443947256035.75,2022-08-18T00:00:00.000Z,2022-08-18T13:02:00.000Z,2022-08-18T23:26:00.000Z,2022-08-18T23:59:59.999Z
17-08-2022,23881.315512357407,24407.0579067141,23243.3544559916,23335.99822236052,30931623076.08,446283604019.97,2022-08-17T00:00:00.000Z,2022-08-17T07:01:00.000Z,2022-08-17T20:07:00.000Z,2022-08-17T23:59:59.999Z
16-08-2022,24126.136482577618,24228.415611524542,23733.499329500355,23883.290546734555,27753685645.65,456730745422.92,2022-08-16T00:00:00.000Z,2022-08-16T01:35:00.000Z,2022-08-16T15:07:00.000Z,2022-08-16T23:59:59.999Z
15-08-2022,24318.31548303852,25135.590396068576,23839.77497510362,24136.972424664084,35123501684.8,461560003436.79,2022-08-15T00:00:00.000Z,2022-08-15T03:19:00.000Z,2022-08-15T23:18:00.000Z,2022-08-15T23:59:59.999Z
14-08-2022,24429.05743708156,24974.914208849306,24206.259772394627,24319.333922599963,22994133555.22,465024405299.05,2022-08-14T00:00:00.000Z,2022-08-14T07:51:00.000Z,2022-08-14T18:05:00.000Z,2022-08-14T23:59:59.999Z
13-08-2022,24402.18747061798,24860.050358193625,24346.114712721206,24424.06783115068,22987346288.83,467007252128.58,2022-08-13T00:00:00.000Z,2022-08-13T06:21:00.000Z,2022-08-13T12:37:00.000Z,2022-08-13T23:59:59.999Z
12-08-2022,23957.20306053137,24412.566105595215,23657.265304318324,24402.818505755808,27265804687.74,466578839477.74,2022-08-12T00:00:00.000Z,2022-08-12T23:40:00.000Z,2022-08-12T11:40:00.000Z,2022-08-12T23:59:59.999Z
11-08-2022,23948.34612720597,24822.62968261603,23900.996865780264,23957.530194268213,37127036580.1,458043109398.07,2022-08-11T00:00:00.000Z,2022-08-11T14:18:00.000Z,2022-08-11T23:11:00.000Z,2022-08-11T23:59:59.999Z
10-08-2022,23162.89884942404,24127.414416091215,22771.520469828967,23947.643425349972,32837431721.55,457833729141.91,2022-08-10T00:00:00.000Z,2022-08-10T13:31:00.000Z,2022-08-10T00:50:00.000Z,2022-08-10T23:59:59.999Z
09-08-2022,23811.483521591905,23898.615369544197,22981.999927379937,23164.317986281327,23555719218.86,442835162483.49,2022-08-09T00:00:00.000Z,2022-08-09T05:39:00.000Z,2022-08-09T14:10:00.000Z,2022-08-09T23:59:59.999Z
08-08-2022,23179.527049985405,24203.6888656304,23176.547253281602,23809.487114518823,28575544847.49,455148536623.69,2022-08-08T00:00:00.000Z,2022-08-08T12:14:00.000Z,2022-08-08T00:04:00.000Z,2022-08-08T23:59:59.999Z
07-08-2022,22963.506243621858,23359.00907631459,22894.556235250388,23175.89084908056,15886817042.79,443014963855.4,2022-08-07T00:00:00.000Z,2022-08-07T21:10:00.000Z,2022-08-07T00:59:00.000Z,2022-08-07T23:59:59.999Z
06-08-2022,23291.42406079369,23326.561622217032,22961.278967129132,22961.278967129132,15978259884.75,438890198160.7,2022-08-06T00:00:00.000Z,2022-08-06T00:52:00.000Z,2022-08-06T23:59:00.000Z,2022-08-06T23:59:59.999Z
05-08-2022,22626.833391275144,23422.827696113807,22612.178514574123,23289.314277414138,28881249043.31,445137234251.88,2022-08-05T00:00:00.000Z,2022-08-05T12:12:00.000Z,2022-08-05T00:04:00.000Z,2022-08-05T23:59:59.999Z
04-08-2022,22848.214384500436,23198.01010723992,22485.700655571534,22630.956732133352,25120229769.19,432532599006.89,2022-08-04T00:00:00.000Z,2022-08-04T01:46:00.000Z,2022-08-04T20:02:00.000Z,2022-08-04T23:59:59.999Z
03-08-2022,22981.302705754573,23578.65044450395,22747.836440439187,22846.50705797548,26288169966.18,436633304289.21,2022-08-03T00:00:00.000Z,2022-08-03T12:22:00.000Z,2022-08-03T01:07:00.000Z,2022-08-03T23:59:59.999Z
02-08-2022,23308.43417279304,23415.04132917102,22710.083979637155,22978.116592947506,28389250717.43,439128030641.55,2022-08-02T00:00:00.000Z,2022-08-02T17:07:00.000Z,2022-08-02T09:46:00.000Z,2022-08-02T23:59:59.999Z
01-08-2022,23336.71805186043,23464.78627722442,22890.796021169328,23314.199432537094,25849159140.74,445527356895.96,2022-08-01T00:00:00.000Z,2022-08-01T14:55:00.000Z,2022-08-01T18:50:00.000Z,2022-08-01T23:59:59.999Z
31-07-2022,23652.069662121907,24121.64257825973,23275.702500450712,23336.895604984285,23553591896.25,445941074223.04,2022-07-31T00:00:00.000Z,2022-07-31T18:16:00.000Z,2022-07-31T22:52:00.000Z,2022-07-31T23:59:59.999Z
30-07-2022,23796.81861062155,24572.579421746883,23580.508484479444,23656.207025584175,28148218300.58,452020722098.65,2022-07-30T00:00:00.000Z,2022-07-30T15:49:00.000Z,2022-07-30T22:19:00.000Z,2022-07-30T23:59:59.999Z
29-07-2022,23845.212373894152,24294.78645683116,23481.173139669118,23804.633234567213,35887249745.78,454837507676.2,2022-07-29T00:00:00.000Z,2022-07-29T06:43:00.000Z,2022-07-29T13:07:00.000Z,2022-07-29T23:59:59.999Z
28-07-2022,22933.641248968772,24110.469919684925,22722.265123275796,23843.88620773817,40212386157.74,455565748691.77,2022-07-28T00:00:00.000Z,2022-07-28T21:14:00.000Z,2022-07-28T12:34:00.000Z,2022-07-28T23:59:59.999Z
27-07-2022,21244.16955918891,22986.529403004854,21070.8061258165,22930.548445700042,31758955233.31,438095993233.22,2022-07-27T00:00:00.000Z,2022-07-27T19:28:00.000Z,2022-07-27T03:49:00.000Z,2022-07-27T23:59:59.999Z
26-07-2022,21361.12187130348,21361.12187130348,20776.81608248064,21239.754379825084,28624673855.33,405770108604.64,2022-07-26T00:00:00.000Z,2022-07-26T00:00:00.000Z,2022-07-26T15:56:00.000Z,2022-07-26T23:59:59.999Z
25-07-2022,22607.155546771657,22649.12136656825,21361.64345454413,21361.700521903997,35574561406.16,408078695877.99,2022-07-25T00:00:00.000Z,2022-07-25T00:19:00.000Z,2022-07-25T23:58:00.000Z,2022-07-25T23:59:59.999Z
24-07-2022,22465.509266066096,22974.002672175862,22306.840180484956,22609.164770669046,23565495302.99,431888879541.1,2022-07-24T00:00:00.000Z,2022-07-24T22:46:00.000Z,2022-07-24T04:14:00.000Z,2022-07-24T23:59:59.999Z
23-07-2022,22706.983427210867,22977.21100155044,22002.91061482952,22465.477627424836,24021799168.58,429122209145.36,2022-07-23T00:00:00.000Z,2022-07-23T05:17:00.000Z,2022-07-23T18:08:00.000Z,2022-07-23T23:59:59.999Z
22-07-2022,23163.75206257678,23671.928528423792,22603.415100676466,22714.979148228704,31421555645.94,433866028177.06,2022-07-22T00:00:00.000Z,2022-07-22T13:52:00.000Z,2022-07-22T20:49:00.000Z,2022-07-22T23:59:59.999Z
21-07-2022,23233.20197091283,23388.322172163498,22431.149394530777,23164.62875470473,33631012203.97,442435421338.91,2022-07-21T00:00:00.000Z,2022-07-21T01:17:00.000Z,2022-07-21T14:37:00.000Z,2022-07-21T23:59:59.999Z
20-07-2022,23393.192011630057,24196.81921397772,23009.94976320096,23231.731965117207,42932549127.33,443696738856.27,2022-07-20T00:00:00.000Z,2022-07-20T15:38:00.000Z,2022-07-20T01:10:00.000Z,2022-07-20T23:59:59.999Z
19-07-2022,22467.85009614443,23666.962253708287,21683.406376392304,23389.43284647952,48765202697.15,446690803766.25,2022-07-19T00:00:00.000Z,2022-07-19T21:58:00.000Z,2022-07-19T06:52:00.000Z,2022-07-19T23:59:59.999Z
18-07-2022,20781.911503996675,22633.03343622373,20781.911503996675,22485.68925217611,39974475561.94,429412153274.1,2022-07-18T00:00:00.000Z,2022-07-18T16:04:00.000Z,2022-07-18T00:00:00.000Z,2022-07-18T23:59:59.999Z
17-07-2022,21195.041213834647,21600.640119359858,20778.17987522355,20779.344539850914,22927802082.64,396808327004.88,2022-07-17T00:00:00.000Z,2022-07-17T07:13:00.000Z,2022-07-17T23:58:00.000Z,2022-07-17T23:59:59.999Z
16-07-2022,20834.10412942899,21514.403330219422,20518.898781973472,21190.315667621857,24302954056.04,404639672831.08,2022-07-16T00:00:00.000Z,2022-07-16T17:23:00.000Z,2022-07-16T06:40:00.000Z,2022-07-16T23:59:59.999Z
15-07-2022,20573.156297917543,21138.243327044824,20396.999134385405,20836.32864452433,25905575358.62,397861215081.44,2022-07-15T00:00:00.000Z,2022-07-15T20:01:00.000Z,2022-07-15T01:22:00.000Z,2022-07-15T23:59:59.999Z
14-07-2022,20211.465955545355,20789.893672194154,19689.258743333994,20569.920061528435,31158743333.4,392755738689.37,2022-07-14T00:00:00.000Z,2022-07-14T19:32:00.000Z,2022-07-14T13:43:00.000Z,2022-07-14T23:59:59.999Z
13-07-2022,19325.972724650128,20223.05264789267,18999.953131778995,20212.073498093006,33042430345.48,385908229967.86,2022-07-13T00:00:00.000Z,2022-07-13T23:19:00.000Z,2022-07-13T13:34:00.000Z,2022-07-13T23:59:59.999Z
12-07-2022,19970.475022939816,20043.445406663748,19308.53061690194,19323.914856106,25810220017.7,368936762200.6,2022-07-12T00:00:00.000Z,2022-07-12T05:49:00.000Z,2022-07-12T23:55:00.000Z,2022-07-12T23:59:59.999Z
11-07-2022,20856.35296768496,20856.35296768496,19924.53979689857,19970.55659323297,24150249024.63,381264246558.41,2022-07-11T00:00:00.000Z,2022-07-11T00:00:00.000Z,2022-07-11T23:08:00.000Z,2022-07-11T23:59:59.999Z
